contributors_enabled,created_at,default_profile,default_profile_image,description,favourites_count,followers_count,friends_count,geo_enabled,lang,listed_count,location,name,profile_background_color,profile_background_image_url,profile_background_tile,profile_banner_url,profile_image_url,profile_link_color,profile_sidebar_fill_color,profile_text_color,protected,screen_name,status_created_at,status_hashtags,status_lang,statuses_count,text,time_zone,url,user_id,user_mentions,verified,follows_subject
False,Mon Apr 13 12:31:58 +0000 2009,True,False,Have you got your donor card? There are poor remoaners out there that need urgent brain and backbone replacements....,2433,378,1496,True,en,27,London,Beaksateer,C0DEED,http://abs.twimg.com/images/themes/theme1/bg.png,False,https://pbs.twimg.com/profile_banners/30855816/1460396631,http://pbs.twimg.com/profile_images/679725543672033280/ozwIMFNw_normal.png,1DA1F2,DDEEF6,333333,False,Beaklington,Thu Feb 08 08:34:36 +0000 2018,[],en,20526,RT @Arron_banks: Important to note a 15 year forecast is a complete bunch of bollocks with a ribbon on it! https://t.co/ZsMCrufswf,London,,30855816,"[User(ID=3390728889, ScreenName=Arron_banks)]",False,1017280993
False,Thu Sep 27 10:52:05 +0000 2012,False,False,"Freelance journalist // interested in social issues, environment, design and Japanese culture -             Letuviškai/Eng/日本語 @cityunilondon @goodcoffeeme",908,270,473,True,en,13,Japan,Audrey Fiodorenko,000000,http://abs.twimg.com/images/themes/theme1/bg.png,False,https://pbs.twimg.com/profile_banners/849047628/1409492262,http://pbs.twimg.com/profile_images/555498650500345856/IcyNunpE_normal.jpeg,94D487,000000,000000,False,AudroneFio,Thu Dec 14 11:07:00 +0000 2017,[],en,528,Hello @Yadira_FARC I am currently fact-checking the interview that you did for Monocle magazine. May I DM you to double check a few things?,,https://t.co/DlYqDNmCyR,849047628,"[User(ID=3321750804, ScreenName=Yadira_FARC)]",False,1017280993
False,Sat Jan 01 10:34:15 +0000 2011,False,False,"generalist, strong economic WEST Europe region,religion only in person;religionfree against Dutch lies&old political system/cartel",14007,1261,2670,False,nl,9,"Breda,Netherlands",ACAM,000000,http://abs.twimg.com/images/themes/theme1/bg.png,False,,http://pbs.twimg.com/profile_images/680745812402548736/cEC8grMP_normal.jpg,3B94D9,000000,000000,False,acam_br,Thu Feb 08 18:16:36 +0000 2018,[],nl,11283,MONSTERVERBOND IN DUITSLAND OP WEG NAAR MACRONS FRANSE VOORSTEDEN OM NOG EENS n 1000 tal Noordafrikaanse dorpen dez… https://t.co/hAm332eez6,Greenland,,232805236,[],False,1017280993
False,Sat May 05 07:24:01 +0000 2012,False,True,islam does NOT mean peace. islam MEANS submission to sharia. Apostasy in sharia states - https://t.co/lC1fAuaWSJ RT ≠ endorsement,39561,1767,3732,True,en,48,"England, United Kingdom",Adapter Mangos,FFFFFF,http://abs.twimg.com/images/themes/theme19/bg.gif,False,,http://abs.twimg.com/sticky/default_profile_images/default_profile_normal.png,006600,DDEEF6,333333,False,TamIMisledUs,Thu Feb 08 23:43:47 +0000 2018,[],en,72515,Majority of Muslim Migrants in Europe Believe in Supremacy of Sharia Law https://t.co/BUqL4wkqVf via @creepingsharia,Casablanca,,571621476,"[User(ID=15650882, ScreenName=creepingsharia)]",False,1017280993
False,Fri Jun 05 07:36:01 +0000 2015,True,False,,4822,418,1407,False,ko,2,,봉환 김,C0DEED,http://abs.twimg.com/images/themes/theme1/bg.png,False,,http://pbs.twimg.com/profile_images/920556455052288000/pb4Xf8fg_normal.jpg,1DA1F2,DDEEF6,333333,False,iron196369,Thu Feb 08 22:06:06 +0000 2018,[],en,726,@JimYongKim Thanks a lot,,,3236745116,"[User(ID=3239192692, ScreenName=JimYongKim)]",False,1017280993
False,Wed Sep 28 19:08:39 +0000 2016,True,True,,65,1,14,False,en-gb,0,,Michele Gorraiz,F5F8FA,,False,,http://abs.twimg.com/sticky/default_profile_images/default_profile_normal.png,1DA1F2,DDEEF6,333333,False,GorraizMichele,NaN,NaN,NaN,0,NaN,,,781209017964191745,NaN,False,1017280993
False,Thu Jan 05 18:56:38 +0000 2012,True,False,"Supporter of center right politics but love following all political views. 
I'm a proud Brit and animal lover.",16325,870,1574,True,en,10,,MattvonB,C0DEED,http://abs.twimg.com/images/themes/theme1/bg.png,False,https://pbs.twimg.com/profile_banners/455983401/1424385832,http://pbs.twimg.com/profile_images/817501548716630016/KWqLH6Gu_normal.jpg,1DA1F2,DDEEF6,333333,False,mattvonbe,Wed Feb 07 22:38:45 +0000 2018,[],und,4457,@HarrietHarman @Tesco  https://t.co/rN1lOFdD6f,,,455983401,"[User(ID=19977759, ScreenName=HarrietHarman), User(ID=271986064, ScreenName=Tesco)]",False,1017280993
False,Wed Feb 04 07:32:32 +0000 2009,False,False,"Too liberal for many conservatives, too conservative for many liberals, not libertarian enough for many libertarians, but happy to speak with all.",57549,397,511,False,en,13,UK,Clinton O'Shea,DBE9ED,http://pbs.twimg.com/profile_background_images/782683358/1719e896d961e10d06f40f0bfaf9733c.jpeg,True,https://pbs.twimg.com/profile_banners/20033647/1467284600,http://pbs.twimg.com/profile_images/766061106985140224/aD3zD-4O_normal.jpg,3B94D9,E6F6F9,333333,False,ClintonOShea,Thu Feb 08 20:20:57 +0000 2018,[],und,8940,RT @Holbornlolz: https://t.co/uHnFoH4jy0,London,https://t.co/0JZdciOTOC,20033647,"[User(ID=1957125536, ScreenName=Holbornlolz)]",False,1017280993
False,Mon Apr 28 12:08:47 +0000 2014,True,False,From a private island - in my head - devoted to scientific and technological advancement. Doctor of profanity; Keeper of the Tsars' Beasts - an inherited title,16197,809,1853,False,en,69,Foaming At The Mouth,Fire and Fury,C0DEED,http://abs.twimg.com/images/themes/theme1/bg.png,False,https://pbs.twimg.com/profile_banners/2467652244/1468441798,http://pbs.twimg.com/profile_images/669583322595594242/AbBLYnch_normal.jpg,1DA1F2,DDEEF6,333333,False,turtlesisland,Thu Feb 08 20:38:50 +0000 2018,[],en,56286,RT @DVATW: Anyone surprised that parts of Government are actively encouraging the Hijab? https://t.co/GFYbltNhqh,,,2467652244,"[User(ID=19899606, ScreenName=DVATW)]",False,1017280993
False,Mon May 04 12:47:03 +0000 2009,False,False,"We find 1st jobs for young people, develop their careers via our 'Zero to Degree' Apprenticeship and help businesses build future-proof workforces.",1948,8306,930,True,en,149,"HQ London, Branches UK wide",MiddletonMurray,FF6600,http://pbs.twimg.com/profile_background_images/378800000171964589/oefTW8dk.png,False,https://pbs.twimg.com/profile_banners/37651985/1501597475,http://pbs.twimg.com/profile_images/885782925983309824/LWVhT7Ql_normal.jpg,F0772F,FF6600,000000,False,MiddletonMurray,Thu Feb 08 17:10:17 +0000 2018,[Hashtag(Text='2018GSAM')],en,6950,"Chairman Angela Middleton, speaking at the @GoldmanSachs #2018GSAM Future Leaders Conference🎤👏 https://t.co/2v5j9NWNlq",London,https://t.co/YSkw6gHOdQ,37651985,"[User(ID=253167239, ScreenName=GoldmanSachs)]",False,1017280993
False,Wed Aug 06 11:43:19 +0000 2008,True,False,Scottish British Patriot and very proud of our Anglo Saxon British heritage! It's never to late to save #UK #Brexit @Nigel_Farage @realDonaldTrump,991,217,658,False,en,11,"Beaconsfield, England",Poocha,C0DEED,http://abs.twimg.com/images/themes/theme1/bg.png,False,https://pbs.twimg.com/profile_banners/15748766/1487075442,http://pbs.twimg.com/profile_images/831480587982610432/BSUsZvHq_normal.jpg,1DA1F2,DDEEF6,333333,False,Poocha,Thu Feb 08 08:39:52 +0000 2018,[],en,2488,@TalbertSwan @HopeRadio1 @realDonaldTrump @Olympics Obama nice guy but eight years in office and his shining achiev… https://t.co/a1QLZgfEhU,London,,15748766,"[User(ID=16873455, ScreenName=TalbertSwan), User(ID=1601008946, ScreenName=HopeRadio1), User(ID=25073877, ScreenName=realDonaldTrump), User(ID=52422878, ScreenName=Olympics)]",False,1017280993
False,Thu Jun 03 18:34:38 +0000 2010,False,False,17-24-30 No to Hate Crime Campaign = October National Hate Crime Awareness Week #NHCAW & April Acts of Remembrance 17 Brixton 24 Brick lane 30 Soho #AAR,1004,2650,4655,False,en,94,"Studio 151, 77 Beak St, W1F 9D",172430 No to Hate,642D8B,http://pbs.twimg.com/profile_background_images/378800000070349414/fa86bea3df7bfc387ec84339cb8df429.jpeg,True,https://pbs.twimg.com/profile_banners/151572820/1510953866,http://pbs.twimg.com/profile_images/828960836261670912/uT5uO01F_normal.jpg,ABB8C2,DDEEF6,333333,False,NationalHCAW,Wed Feb 07 13:38:53 +0000 2018,[Hashtag(Text='LGBT')],en,4371,RT @BTPDiversity: Spending today with representatives from the @BTP #LGBT &amp; Black Police Associations today at the @wiltshirepolice Diversi…,London,https://t.co/UVDxoN7ezx,151572820,"[User(ID=3118151775, ScreenName=BTPDiversity), User(ID=266094415, ScreenName=BTP), User(ID=66327431, ScreenName=wiltshirepolice)]",False,1017280993
False,Tue Sep 09 10:40:40 +0000 2014,False,False,"Political news, analysis and insight from the award winning Public Affairs team at PHA Media",1170,1019,2799,True,en,21,"Soho, London",PHA Public Affairs,000000,http://abs.twimg.com/images/themes/theme1/bg.png,False,https://pbs.twimg.com/profile_banners/2799652760/1449500900,http://pbs.twimg.com/profile_images/672370672333492225/O6L58t-E_normal.jpg,3B94D9,000000,000000,False,PHAPolitical,Wed Jan 17 20:10:57 +0000 2018,[],en,2745,Brilliant to see Lord Naseby calling for stronger checks on companies registering at Companies House tonight in the… https://t.co/LAt5LXX8HN,,http://t.co/SLCKRJCkLL,2799652760,[],False,1017280993
False,Thu May 24 09:54:29 +0000 2012,True,False,,1329,442,1143,False,en,3,,Onepercent,C0DEED,http://abs.twimg.com/images/themes/theme1/bg.png,False,https://pbs.twimg.com/profile_banners/589000540/1469536171,http://pbs.twimg.com/profile_images/757913617899585536/WTbL3jtw_normal.jpg,1DA1F2,DDEEF6,333333,False,Adenoughofit,Thu Jan 25 19:18:46 +0000 2018,[],en,11132,"@slowhands27 @steve_steglitz @Yair_Rosenberg @HashtagGriswold 
How are things in your cubicle Dan? https://t.co/9as3s27IrN",Pacific Time (US & Canada),,589000540,"[User(ID=230256346, ScreenName=slowhands27), User(ID=791001485693816832, ScreenName=steve_steglitz), User(ID=532779460, ScreenName=Yair_Rosenberg), User(ID=1536600704, ScreenName=HashtagGriswold)]",False,1017280993
False,Sun Mar 02 16:18:18 +0000 2014,True,False,,7961,163,417,False,en,3,"Amsterdam, The Netherlands",Johnny P,C0DEED,http://abs.twimg.com/images/themes/theme1/bg.png,False,,http://pbs.twimg.com/profile_images/926851845343072256/ZRY03OUc_normal.jpg,1DA1F2,DDEEF6,333333,False,sunblazed,Thu Feb 08 08:32:10 +0000 2018,[],en,2860,"RT @Michael_Heaver: Anti-Brexit billionaire George Soros has had regular meetings with EU officials.

Here he is with Juncker - EU politics…",,,2369090960,"[User(ID=22800916, ScreenName=Michael_Heaver)]",False,1017280993
False,Wed Apr 28 06:20:27 +0000 2010,True,False,Retweets not necessarily endorsements,8950,177,629,True,en,3,London / Harlow,chris staunton,C0DEED,http://abs.twimg.com/images/themes/theme1/bg.png,False,,http://pbs.twimg.com/profile_images/746640246968815616/YkmSwl7s_normal.jpg,1DA1F2,DDEEF6,333333,True,chris6360,NaN,NaN,NaN,3543,NaN,London,,137949550,NaN,False,1017280993
False,Tue Dec 07 17:56:36 +0000 2010,False,False,.... YNWA,413,1460,2335,False,en,28,bristol uk,zagenstar,131516,http://abs.twimg.com/images/themes/theme14/bg.gif,True,https://pbs.twimg.com/profile_banners/223922396/1465184730,http://pbs.twimg.com/profile_images/957975431348703232/amFDBgl-_normal.jpg,998000,DDEEF6,333333,False,anttJ1892,Thu Feb 08 21:42:07 +0000 2018,[],en,4079,RT @Geezajay2013: David Kennedy. He's 90 years old and during the 2nd World War he served in the Arctic Convoy (HMS Domett K473). Churchill…,London,,223922396,"[User(ID=1868678738, ScreenName=Geezajay2013)]",False,1017280993
False,Tue Feb 17 20:14:54 +0000 2015,True,False,,3,185,2734,False,en,0,Milton Keynes,John Lambs,C0DEED,http://abs.twimg.com/images/themes/theme1/bg.png,False,,http://pbs.twimg.com/profile_images/567815895460769792/Vi7Vmdoo_normal.jpeg,1DA1F2,DDEEF6,333333,False,john_lambs,Thu Dec 07 16:52:57 +0000 2017,[],en,44,@BurgerKingUK the slowest fast food in the world is inside Westfield (Wood Lane). It took 30 minutes to be served a… https://t.co/4trwzhiCgd,Dublin,,3043494573,"[User(ID=2764632382, ScreenName=BurgerKingUK)]",False,1017280993
False,Tue Apr 28 18:51:02 +0000 2009,False,False,"Traditionalist. Free speech advocate. 'You will know the truth, and the truth will make you free.'",62,966,4208,False,en-gb,16,Gough Island,Mark Uden,C8102E,http://abs.twimg.com/images/themes/theme14/bg.gif,True,https://pbs.twimg.com/profile_banners/36146407/1491674257,http://pbs.twimg.com/profile_images/895715550499926018/A091xLN4_normal.jpg,003399,000000,000000,False,MarkUden,Thu Feb 08 20:58:03 +0000 2018,[],en,1280,"RT @Sage_Opinion: BBC news reports that an extrapolation of DNA data on 10,000 year old Cheddar Man reveals he would today be pro EU, vote…",London,https://t.co/YFf8P3O3xJ,36146407,"[User(ID=776012214, ScreenName=Sage_Opinion)]",False,1017280993
False,Tue Jul 01 00:17:20 +0000 2014,True,False,UKIP Supporter promoting my book 'Let's Get Out of the EU' for sale on Amazon in paper back & E-book it gives a humourous view of the problems with the EU,1239,1145,1807,False,en-gb,25,England,Carly G Jeffries,C0DEED,http://abs.twimg.com/images/themes/theme1/bg.png,False,https://pbs.twimg.com/profile_banners/2658114597/1413841196,http://pbs.twimg.com/profile_images/776813884556574721/i6FNNH0U_normal.jpg,1DA1F2,DDEEF6,333333,False,Shasha1960G,Thu Feb 08 17:10:52 +0000 2018,[],en,4600,How ridiculous of Ollie! Why does he feel the necessity to jump on other peoples beds like a two year old and his s… https://t.co/9zUHjyNL33,,https://t.co/oUVj9O0hzj,2658114597,[],False,1017280993
False,Mon Aug 29 10:28:39 +0000 2016,False,False,.,6843,37,187,False,en,0,South East London ,Derek Bradford,000000,http://abs.twimg.com/images/themes/theme1/bg.png,False,,http://pbs.twimg.com/profile_images/887252063536676864/RwV1Lqsi_normal.jpg,1B95E0,000000,000000,False,BlatantCrusader,Thu Feb 08 20:45:09 +0000 2018,[Hashtag(Text='Soros')],en,2241,"RT @Michael_Heaver: 942 tweets vs. £400,000 #Soros https://t.co/MrzSCGkRzY",,,770206521678503936,"[User(ID=22800916, ScreenName=Michael_Heaver)]",False,1017280993
False,Sun Sep 11 23:53:57 +0000 2016,True,True,,2,1,16,False,en-gb,0,,Samuel,F5F8FA,,False,,http://abs.twimg.com/sticky/default_profile_images/default_profile_normal.png,1DA1F2,DDEEF6,333333,False,KIWIEGYPTIAN,Sun Sep 10 22:17:42 +0000 2017,[],en,4,"Well done Simon, many people with similar views. Not voiced because we are afraid the violent left who will call us… https://t.co/lhBVnOHMfB",,,775120221598126081,[],False,1017280993
False,Sun Aug 09 13:30:02 +0000 2015,True,False,"Sailor, cyclist, golfer, Ukipper and Libertarian; man made global warming is a politically inspired scientific fraud (http://t.co/8ABe43Xo68).",7,53,92,True,en-gb,3,,Mike Ferro,C0DEED,http://abs.twimg.com/images/themes/theme1/bg.png,False,https://pbs.twimg.com/profile_banners/3310547742/1442774117,http://pbs.twimg.com/profile_images/640845387474055168/PhMgSvx9_normal.jpg,1DA1F2,DDEEF6,333333,False,mike32811,Tue Feb 06 21:33:54 +0000 2018,[],en,567,"So M Barnier threatens 'barriers to trade' when we're outside the EU
There are barriers to trade now; we can't trad… https://t.co/Ib1TAqQqCv",Pacific Time (US & Canada),http://t.co/mmIV5DqHRz,3310547742,[],False,1017280993
False,Wed Sep 02 15:24:34 +0000 2015,False,False,,876,672,4308,False,en,1,Haiti,Cars 3 leaked,000000,http://abs.twimg.com/images/themes/theme1/bg.png,False,https://pbs.twimg.com/profile_banners/3524559562/1473882468,http://pbs.twimg.com/profile_images/840897685632745472/bKGa6KKW_normal.jpg,F58EA8,000000,000000,False,jakester876,Fri Nov 17 13:34:52 +0000 2017,[],und,641,RT @GameTheoryRejct: https://t.co/F3kvwU6qwc,,https://t.co/j0MzzdWflI,3524559562,"[User(ID=3295670177, ScreenName=GameTheoryRejct)]",False,1017280993
False,Fri Jul 25 15:54:08 +0000 2014,False,False,"England and Lions Rugby supporter, proud to be both English and British",28823,1663,1049,True,en,71,"Hampshire, UK",englishdave,000000,http://abs.twimg.com/images/themes/theme1/bg.png,False,https://pbs.twimg.com/profile_banners/2679899798/1406375442,http://pbs.twimg.com/profile_images/869819363850899456/dt5vvj1D_normal.jpg,981CEB,000000,000000,False,davealexukip,Wed Feb 07 22:22:00 +0000 2018,[],en,34663,"RT @markantro: Remainers miss the key philosophy behind vote leave.

It’s not about wealth (I’ve no doubt that’ll follow)

We voted leave f…",London,,2679899798,"[User(ID=2832135565, ScreenName=markantro)]",False,1017280993
False,Wed Sep 18 17:00:07 +0000 2013,True,False,,1063,74,354,True,en,1,sw12,Angela Tinkler,C0DEED,http://abs.twimg.com/images/themes/theme1/bg.png,False,https://pbs.twimg.com/profile_banners/1880130654/1442130689,http://pbs.twimg.com/profile_images/378800000474821877/4c151dcaa5ce763112fd80c611f8c756_normal.jpeg,1DA1F2,DDEEF6,333333,False,angela_tinkler,Thu Feb 08 22:06:35 +0000 2018,[],tl,1528,@steveallenshow Lalala,,,1880130654,"[User(ID=17706119, ScreenName=steveallenshow)]",False,1017280993
False,Mon May 02 22:24:21 +0000 2011,True,False,UN EU Wesminster Cardiff ConwyBoroughCouncil TownCouncil I don't need 1/2 of these.And abolish House of Croney Lords,7680,390,720,True,en,3,Llandudno Wales,William Campbell,C0DEED,http://abs.twimg.com/images/themes/theme1/bg.png,False,,http://pbs.twimg.com/profile_images/1336364401/3.11_normal.jpg,1DA1F2,DDEEF6,333333,False,WDMCampbell,Thu Feb 08 20:59:38 +0000 2018,[],en,2625,"RT @WestmonsterUK: Man who travelled abroad to fight against ISIS is charged with a terror offence.

Yet hundreds of returning jihadis are…",London,,291971488,"[User(ID=801446214784925696, ScreenName=WestmonsterUK)]",False,1017280993
False,Tue Aug 31 18:52:53 +0000 2010,True,False,"A father first and foremost. Interested in all things education, law, order and political. All views expressed my own. RT's not always an endorsement.",55,438,1892,False,en,2,"Leeds, England",Richard Cowles,C0DEED,http://abs.twimg.com/images/themes/theme1/bg.png,False,,http://pbs.twimg.com/profile_images/712675228418179072/Py8eXaGp_normal.jpg,1DA1F2,DDEEF6,333333,False,RickyCowles,NaN,NaN,NaN,2,NaN,London,,185330903,NaN,False,1017280993
False,Wed Jan 19 10:59:54 +0000 2011,False,False,We will be Better Out of the EU. GB will become GREAT again. We will leave 27 & Rejoin the Global Economy,8829,2205,2935,False,en,40,"East Midlands, England",Phil,131516,http://abs.twimg.com/images/themes/theme14/bg.gif,True,https://pbs.twimg.com/profile_banners/240192814/1517412748,http://pbs.twimg.com/profile_images/813430513578967040/IjVL6H6K_normal.jpg,009999,EFEFEF,333333,False,Blackbirds1632,Thu Feb 08 21:41:16 +0000 2018,[],en,15904,"RT @Econs4FreeTrade: Thanks to Brexit, the full benefits of free trade will be made available to everyone - @LiamFox https://t.co/D87EjkEDGO",Europe/Belfast,,240192814,"[User(ID=725469917844262914, ScreenName=Econs4FreeTrade), User(ID=532241033, ScreenName=LiamFox)]",False,1017280993
False,Sun Mar 09 20:28:04 +0000 2014,True,False,,1953,670,1023,False,en-gb,18,Portadown,CllrDavidJonesUKIP,C0DEED,http://abs.twimg.com/images/themes/theme1/bg.png,False,,http://pbs.twimg.com/profile_images/443053038920814592/N1FPcRDr_normal.jpeg,1DA1F2,DDEEF6,333333,False,UkipCllr,Mon Feb 05 09:26:45 +0000 2018,[],en,1241,@Jo_Marney Because he is a laughing stock dear,,,2397707836,"[User(ID=430090745, ScreenName=Jo_Marney)]",False,1017280993
False,Wed Oct 07 13:10:14 +0000 2015,True,False,,789,26,252,False,en,0,Birmingham UK,Alan Blumenthal,C0DEED,http://abs.twimg.com/images/themes/theme1/bg.png,False,,http://pbs.twimg.com/profile_images/800091406979256321/db1YYor6_normal.jpg,1DA1F2,DDEEF6,333333,True,alanblumenthal2,NaN,NaN,NaN,255,NaN,,,3890286268,NaN,False,1017280993
False,Thu Apr 10 21:52:32 +0000 2014,True,False,UKIP,143,145,148,False,en,28,,Stephen Crosby,C0DEED,http://abs.twimg.com/images/themes/theme1/bg.png,False,https://pbs.twimg.com/profile_banners/2474868364/1506898209,http://pbs.twimg.com/profile_images/919219382336872448/X3QCGq4R_normal.jpg,1DA1F2,DDEEF6,333333,False,stephen_crosby1,Wed Feb 07 12:27:48 +0000 2018,[],en,32,The EU is the enemy of the working classes https://t.co/KpARGuqodQ,London,,2474868364,[],False,1017280993
False,Sun Apr 17 20:41:45 +0000 2016,False,False,,4440,355,159,True,en-gb,20,,Sadie Coulson 🇬🇧,000000,http://abs.twimg.com/images/themes/theme1/bg.png,False,https://pbs.twimg.com/profile_banners/721800840101634048/1515764035,http://pbs.twimg.com/profile_images/960196149343932417/rfOIbig__normal.jpg,F58EA8,000000,000000,True,Sadie_Coulson,NaN,NaN,NaN,6671,NaN,,,721800840101634048,NaN,False,1017280993
False,Wed Feb 25 16:28:11 +0000 2009,True,False,,194,91,1109,True,en,2,Harlow,Mark R.E.Gough,C0DEED,http://abs.twimg.com/images/themes/theme1/bg.png,False,,http://pbs.twimg.com/profile_images/2662937621/81c91cf675d2b561ec0793197daf444d_normal.jpeg,1DA1F2,DDEEF6,333333,False,MarkREGough,Thu Jan 25 14:28:16 +0000 2018,[],en,314,@MrNishKumar Your performance v Swansea on Monday was awful! Grin! Know how you love the Salah comparisons Nish! 😉,London,,21883350,"[User(ID=152785310, ScreenName=MrNishKumar)]",False,1017280993
False,Sat Dec 18 21:32:38 +0000 2010,False,False,Conservative libertarian🇬🇧|| Christian ✝️||British 🇬🇧 || West Ham United ⚽️ || Cricket🏏|| Gym Rat 🏋🏻 ||,411,358,342,False,en,2,London town ,Bryan Deandre,131516,http://abs.twimg.com/images/themes/theme14/bg.gif,True,https://pbs.twimg.com/profile_banners/228147871/1512315043,http://pbs.twimg.com/profile_images/956106573083967488/8s5JlCwT_normal.jpg,009999,EFEFEF,333333,False,BryanDre_2,Thu Feb 01 22:00:43 +0000 2018,[],en,1606,RT @carlosbateson86: West Ham Family.. I'm trying to build up my West Ham following again on Twitter.. I had a big following on my previous…,Lisbon,,228147871,"[User(ID=828520354096234496, ScreenName=carlosbateson86)]",False,1017280993
False,Wed Dec 26 05:52:33 +0000 2012,False,False,✌,37291,33,3777,False,en,0,UK,John,131516,http://abs.twimg.com/images/themes/theme14/bg.gif,True,,http://pbs.twimg.com/profile_images/886047441992208384/v5ufslNp_normal.jpg,3B94D9,000000,000000,True,ChabbyA7,NaN,NaN,NaN,2,NaN,London,,1036418642,NaN,False,1017280993
False,Wed Sep 21 14:53:56 +0000 2016,False,False,"James Dalton Problem Solver, Engineer, #dvp The Democrats and Veterans Party #WeServe",2065,1442,1644,False,en-gb,28,"Yorkshire, England",James Dalton,000000,http://abs.twimg.com/images/themes/theme1/bg.png,False,https://pbs.twimg.com/profile_banners/778608205333196800/1516140890,http://pbs.twimg.com/profile_images/858481539629404161/QSKtjqC-_normal.jpg,ABB8C2,000000,000000,False,JamesDaltondvp,Thu Feb 08 13:53:32 +0000 2018,[],en,4793,"RT @VeteransBritain: Foreign magnates are now in plain sight manipulating British politics.
Please use this as a rallying cry to encourage…",Pacific Time (US & Canada),,778608205333196800,"[User(ID=700512166949089282, ScreenName=VeteransBritain)]",False,1017280993
False,Wed Aug 24 21:13:21 +0000 2011,False,False,"Audio Visual, Electronics, Musician. Christian. Political (Ex UKIP, now Conservative). Former PPC. I'm centre right, with a touch of centre left. Brexit please.",26,2055,2590,False,en,54,"Coventry, England",Mark Taylor,000000,http://abs.twimg.com/images/themes/theme19/bg.gif,False,https://pbs.twimg.com/profile_banners/361482802/1517432717,http://pbs.twimg.com/profile_images/800597996777930752/wgTz7aCM_normal.jpg,981CEB,000000,000000,False,MarkPhilTaylor,Thu Feb 08 22:06:45 +0000 2018,[],en,5337,An interesting article from The Spectator. Are two Muslim cultures are emerging in Britain? https://t.co/bVOhj7xAAY,London,,361482802,[],False,1017280993
False,Fri Apr 03 11:41:40 +0000 2015,False,False,"I stand with Trump, even though I'm British. I hate libtards and leftists and LGBtards/ Oh, and Islam. Get on with Brexit! MBGA MAGA",8405,1136,4538,False,en,1,MYOB,Jon Seymour,000000,http://abs.twimg.com/images/themes/theme1/bg.png,False,https://pbs.twimg.com/profile_banners/3135356466/1505543672,http://pbs.twimg.com/profile_images/901914706402836481/zZp28VkV_normal.jpg,1B95E0,000000,000000,True,jonseymour0791,NaN,NaN,NaN,5277,NaN,,,3135356466,NaN,False,1017280993
False,Thu Nov 08 20:51:05 +0000 2012,True,False,,104,322,390,True,en,8,,cliff tyler,C0DEED,http://abs.twimg.com/images/themes/theme1/bg.png,False,,http://pbs.twimg.com/profile_images/566406161969459200/lZQa37cB_normal.jpeg,1DA1F2,DDEEF6,333333,False,tylercab,Thu Feb 08 11:01:42 +0000 2018,[],en,7752,"RT @bigphilcampion: Bring back the Royal Tournament and let’s beat drums , wave flags and celebrate our armed forces. 🇬🇧promote recruitment…",,,935411395,"[User(ID=545062246, ScreenName=bigphilcampion)]",False,1017280993
False,Tue Feb 24 09:33:41 +0000 2009,False,False,The Charity that delivers an advanced trauma team to critically injured people in London. To donate visit https://t.co/zIsmYIxJsF,8431,53932,1727,True,en,524,London,London'sAirAmbulance,FFFFFF,http://pbs.twimg.com/profile_background_images/817904276/26a344686dccffd342a700308097f8be.jpeg,True,https://pbs.twimg.com/profile_banners/21741353/1514888631,http://pbs.twimg.com/profile_images/923895089688129536/cM5DHRVW_normal.jpg,FF3300,A0C5C7,333333,False,LDNairamb,Thu Feb 08 20:45:00 +0000 2018,[],en,15555,If you missed it earlier make sure to watch @BBCNews at 10 to see @BBCHughPym report on the PRU-our innovative emer… https://t.co/Tddu4tGxZN,London,http://t.co/rRhKjTRwq1,21741353,"[User(ID=612473, ScreenName=BBCNews), User(ID=157044469, ScreenName=BBCHughPym)]",True,1017280993
