contributors_enabled,created_at,default_profile,default_profile_image,description,favourites_count,followers_count,friends_count,geo_enabled,lang,listed_count,location,name,profile_background_color,profile_background_image_url,profile_background_tile,profile_banner_url,profile_image_url,profile_link_color,profile_sidebar_fill_color,profile_text_color,protected,screen_name,status_created_at,status_hashtags,status_lang,statuses_count,text,time_zone,url,user_id,user_mentions,verified,follows_subject
False,Fri Jun 05 14:30:05 +0000 2009,True,False,Edan's dad. always 4pm on my tattoo watch...,1514,1557,2684,False,en,32,"London, Brighton & Birmingham",Imran,C0DEED,http://abs.twimg.com/images/themes/theme1/bg.png,False,,http://pbs.twimg.com/profile_images/597717047645110272/S4vzo8Cn_normal.jpg,1DA1F2,DDEEF6,333333,False,imran_1,Thu Feb 08 22:54:55 +0000 2018,[],en,12539,This is a real mess. Huge credit to @CPAGUK @frankfieldteam @heidiallen75 @resfoundation @patrickjbutler and others… https://t.co/ah6N8Hf2aw,,,44903582,"[User(ID=297085579, ScreenName=CPAGUK), User(ID=20688804, ScreenName=frankfieldteam), User(ID=426116125, ScreenName=heidiallen75), User(ID=68377720, ScreenName=resfoundation), User(ID=98682244, ScreenName=patrickjbutler)]",False,1017280993
False,Thu Jun 17 16:06:44 +0000 2010,True,False,,263,360,679,True,en,10,,Grace Loseby,C0DEED,http://abs.twimg.com/images/themes/theme1/bg.png,False,https://pbs.twimg.com/profile_banners/156680212/1427660473,http://pbs.twimg.com/profile_images/551105080473026560/emIAzzEB_normal.jpeg,1DA1F2,DDEEF6,333333,False,GraceLoseby,Wed Jan 24 15:19:08 +0000 2018,[Hashtag(Text='passonplastic')],en,1822,#passonplastic great lunch @dim_t but please no plastic straws next time! @SkyOceanRescue,,,156680212,"[User(ID=168691596, ScreenName=dim_t), User(ID=811529204214988800, ScreenName=SkyOceanRescue)]",False,1017280993
False,Wed Mar 04 11:44:01 +0000 2009,True,False,I expose hypocrisy and fight against the Woefully Inadequate practices of TFL.,2417,5999,4513,True,en,40,,Neil Johnson,C0DEED,http://abs.twimg.com/images/themes/theme1/bg.png,False,https://pbs.twimg.com/profile_banners/22759743/1429267594,http://pbs.twimg.com/profile_images/926352589674962944/zzmC5-yx_normal.jpg,1DA1F2,DDEEF6,333333,False,neiljohnson1974,Sat Feb 03 22:28:39 +0000 2018,[],en,12207,@UnitedCabbies @zoltanmende @guidoacasa Motorised vehicle is illegal,,,22759743,"[User(ID=169935844, ScreenName=UnitedCabbies), User(ID=719705338820354049, ScreenName=zoltanmende), User(ID=788291653937336320, ScreenName=guidoacasa)]",False,1017280993
False,Mon Jun 15 09:01:16 +0000 2015,True,False,"Nous sommes un parti européen #eurosceptique qui se bat pour nos #libertés, plus de #sécurité, le maintien de nos frontières et pour une croissance #économique.",5,418,116,False,fr,15,"Bruxelles, Belgique",ADDE,C0DEED,http://abs.twimg.com/images/themes/theme1/bg.png,False,https://pbs.twimg.com/profile_banners/3326606260/1443775276,http://pbs.twimg.com/profile_images/625994300149628928/qrC9gnKm_normal.png,1DA1F2,DDEEF6,333333,False,ADDEurope,Tue Jan 31 13:12:45 +0000 2017,[Hashtag(Text='Brexit')],en,487,Top City Lobby Group U-Turns and Embraces #Brexit https://t.co/DBdmKWWDI2 via @GuidoFawkes,Brussels,https://t.co/71wuIJRp97,3326606260,"[User(ID=465973, ScreenName=GuidoFawkes)]",True,1017280993
False,Tue Sep 25 23:18:32 +0000 2012,False,False,UKIP County Council & Parliamentary Candidate,484,135,156,True,en,2,Gloucester UK,Daniel Woolf,000000,http://abs.twimg.com/images/themes/theme1/bg.png,False,https://pbs.twimg.com/profile_banners/846390392/1495000360,http://pbs.twimg.com/profile_images/864720295772508161/zoOotRsY_normal.jpg,981CEB,000000,000000,False,DanielWoolfUKIP,Tue Aug 15 11:09:46 +0000 2017,[],en,838,"RT @DianeJamesMEP: UK may have to pay EU in temporary customs union, David Davis suggests https://t.co/J8yA4EhKAr",,https://t.co/xUa791v55h,846390392,"[User(ID=2673995912, ScreenName=DianeJamesMEP)]",False,1017280993
False,Tue Sep 20 19:58:42 +0000 2016,False,False,"Trump won. Get over it.

#FreeKekistan

£20 is £20... if you catch my drift",514,88,319,False,en-gb,1,"Honley, West Yorkshire",Joshua Dalton,000000,http://abs.twimg.com/images/themes/theme1/bg.png,False,https://pbs.twimg.com/profile_banners/778322512379772929/1480428867,http://pbs.twimg.com/profile_images/868767892057272320/HeQOd4jg_normal.jpg,981CEB,000000,000000,False,J_B_Dalton,Fri Jan 05 20:56:25 +0000 2018,[],en,730,RT @OrwellNGoode: .@CountDankulaTV could face a year in prison for a joke. Let's look at other people the UK decided NOT to imprison. I've…,,,778322512379772929,"[User(ID=499230066, ScreenName=OrwellNGoode), User(ID=730121169194655748, ScreenName=CountDankulaTV)]",False,1017280993
False,Sun May 11 18:23:39 +0000 2014,True,False,RealHousewivesofEssex #savelimesfarm,59556,1773,1597,False,en-GB,71,Essex,Samantha 52%,C0DEED,http://abs.twimg.com/images/themes/theme1/bg.png,False,https://pbs.twimg.com/profile_banners/2541458987/1492627894,http://pbs.twimg.com/profile_images/960950243880824832/pj-n_fH5_normal.jpg,1DA1F2,DDEEF6,333333,False,sreynolds196777,Thu Feb 08 23:40:59 +0000 2018,"[Hashtag(Text='gestureegg'), Hashtag(Text='HappyEaster')]",en,71005,RT @AuntiePegg: I’ve seen it all now. Stop the world I want to get off!!! #gestureegg #HappyEaster https://t.co/XOJw7NUqt1,BST,,2541458987,"[User(ID=182474563, ScreenName=AuntiePegg)]",False,1017280993
False,Tue May 24 14:12:31 +0000 2011,True,False,#UKIP #BREXIT  #MAGA #TRUMP,3197,1315,2050,True,en,72,Infidel - Patriot - London,MrUKDeplorable,C0DEED,http://abs.twimg.com/images/themes/theme1/bg.png,False,https://pbs.twimg.com/profile_banners/304432374/1428542648,http://pbs.twimg.com/profile_images/824271771255930881/2MhYNQL0_normal.jpg,1DA1F2,DDEEF6,333333,False,RobHatch2010,Wed Feb 07 17:31:42 +0000 2018,[],en,33776,Anyone Really Identify with Democrat Politicians Anymore? https://t.co/sqJSun3ftb via @YouTube,London,,304432374,"[User(ID=10228272, ScreenName=YouTube)]",False,1017280993
False,Fri Aug 12 19:32:03 +0000 2011,False,False,"Supporter of a FULL #Brexit and common sense. Stop mass immigration and multiculturalism! Love cats, hate animal cruelty. Photography. No porn.",10609,5216,5022,False,en,93,England,Cate 🇬🇧,C6E2EE,http://abs.twimg.com/images/themes/theme2/bg.gif,False,https://pbs.twimg.com/profile_banners/353872365/1516020794,http://pbs.twimg.com/profile_images/958092439407026182/ovEyPUY8_normal.jpg,1F98C7,DAECF4,663B12,False,CataNigra,Thu Feb 08 20:41:52 +0000 2018,[],en,70559,RT @Muddypumpkin: Lancashire County Council are holding a public consultation on the decision to ban non pre stun Halal meat from school me…,Casablanca,,353872365,"[User(ID=747866205822849024, ScreenName=Muddypumpkin)]",False,1017280993
False,Thu Sep 15 19:43:18 +0000 2011,True,False,"Brexiteer, active UKIPer, €uro-doomsayer, Francophile, Rugby-fan Libertarian tooth-fairy non-believer. Opinions my Own.",16451,2548,2635,True,en,135,Eurasia,Paul_Henri_Cadier,C0DEED,http://abs.twimg.com/images/themes/theme1/bg.png,False,,http://pbs.twimg.com/profile_images/639318348564529153/ULOn5sUg_normal.png,1DA1F2,DDEEF6,333333,False,PaulHenriCadier,Thu Feb 08 11:09:53 +0000 2018,[],en,90588,RT @RedHotSquirrel: UK–CHINA TRADE: Richard Burn appointed trade envoy for China. The move is a bid to increase exports to the world’s seco…,,,374141509,"[User(ID=555370896, ScreenName=RedHotSquirrel)]",False,1017280993
False,Sat Feb 05 14:25:17 +0000 2011,False,False,Fighting against unsustainable development in Sittingbourne & Sheppey. Fighting for local people to have a real say in all decisions affecting them.,2305,728,629,False,en,32,"Swale, Kent",Mike Baldock,000000,http://abs.twimg.com/images/themes/theme1/bg.png,False,https://pbs.twimg.com/profile_banners/247762852/1516575707,http://pbs.twimg.com/profile_images/955213277277061127/npl0BCYO_normal.jpg,19CF86,000000,000000,False,VoteMikeBaldock,Thu Feb 08 21:37:42 +0000 2018,[],en,16123,RT @RogerTruelove: Others join in on jumping the gun theme such as @Cllr_NHampshire and @VoteMikeBaldock  and even John Wright. Very forcef…,Amsterdam,,247762852,"[User(ID=394917645, ScreenName=RogerTruelove), User(ID=77199130, ScreenName=Cllr_NHampshire), User(ID=247762852, ScreenName=VoteMikeBaldock)]",False,1017280993
False,Sat Apr 02 17:23:02 +0000 2016,False,False,"UKIP Cambridgeshire. Stood for Little Paxton and Godmanchester & Hunts South in past elections, LGBT* in UKIP committee member. 🏳️‍🌈🇬🇧😇❤️",79,311,319,False,en,6,"England, United Kingdom",Dan Morris,000000,http://abs.twimg.com/images/themes/theme1/bg.png,False,https://pbs.twimg.com/profile_banners/716315014953635840/1484079430,http://pbs.twimg.com/profile_images/778096976885870592/NDQy-mqX_normal.jpg,6C3483,000000,000000,False,DanMorrisUKIP,Fri Dec 15 20:45:09 +0000 2017,[],en,136,Petition: Leave the EU immediately https://t.co/M6tImma7t9,London,https://t.co/1Xdjd41Lss,716315014953635840,[],False,1017280993
False,Thu Jan 22 16:15:31 +0000 2015,False,False,"Woods cleared, headstones destroyed, graves sold off, new dead buried with remains of others. Join the fight savesouthwarkwoods@gmail.com",5248,2772,4935,True,en,70,"London, England",Save Camberwell Cems,000000,http://abs.twimg.com/images/themes/theme1/bg.png,False,https://pbs.twimg.com/profile_banners/2992475896/1463219411,http://pbs.twimg.com/profile_images/925755258042806272/IPoySguU_normal.jpg,4A913C,000000,000000,False,SouthwarkWoods,Wed Jan 31 16:09:02 +0000 2018,[],en,11836,Devastation doesn't end: @lb_southwark  chainsawing trees to sell off inner London land for burial plots - today in… https://t.co/aoXNySUdLs,Dublin,https://t.co/UMaSijizhE,2992475896,"[User(ID=17776744, ScreenName=lb_southwark)]",False,1017280993
False,Wed Jan 09 22:14:09 +0000 2013,True,False,"Walking.Nature.Control of our country.Shocked and saddened at years of decline for British values, way of life, it's not good enough for our children.Get tough.",7058,117,198,False,en,7,,susan holmes,C0DEED,http://abs.twimg.com/images/themes/theme1/bg.png,False,,http://pbs.twimg.com/profile_images/867369882031190017/s0w0g1wO_normal.jpg,1DA1F2,DDEEF6,333333,False,saholmes1956,Tue Oct 24 15:58:57 +0000 2017,[],en,2980,"RT @saholmes1956: Feeling an emotional wreck just now, having had to make that awful decision for our beautiful dog Lex to be put to sleep.",,,1075031016,"[User(ID=1075031016, ScreenName=saholmes1956)]",False,1017280993
False,Fri Apr 26 12:48:20 +0000 2013,True,False,The mass sheep follow the brainwashed tweets,689,202,513,False,en,1,"England, United Kingdom",drake williams,C0DEED,http://abs.twimg.com/images/themes/theme1/bg.png,False,https://pbs.twimg.com/profile_banners/1381822794/1474280398,http://pbs.twimg.com/profile_images/777813353347571713/1e2ztNcB_normal.jpg,1DA1F2,DDEEF6,333333,False,Snatchedback,Sat Nov 18 19:16:30 +0000 2017,[],en,1929,@Number10gov https://t.co/djyntjpMag PHEDOFILE CAUGHT LIVE NOW !! PLEASE SHARE THIS RAT !! THERE IS NO MORE REAL JUSTICE !!,Pacific Time (US & Canada),,1381822794,"[User(ID=14224719, ScreenName=Number10gov)]",False,1017280993
False,Sat Sep 08 21:43:59 +0000 2012,True,False,#livingthedream,63,74,429,True,en,0,"London, England",Crazy T,C0DEED,http://abs.twimg.com/images/themes/theme1/bg.png,False,https://pbs.twimg.com/profile_banners/811754246/1466327994,http://pbs.twimg.com/profile_images/744459679217123328/mNX7A8tr_normal.jpg,1DA1F2,DDEEF6,333333,False,TanishaCM88,Mon Jan 29 21:25:27 +0000 2018,[Hashtag(Text='genius')],en,249,"RT @Cath_Tyldesley: Audrey, Gail and Sarah in the lap dancing Club ... #genius @itvcorrie @ITV 😂😂😂🙌🏻🙌🏻🙌🏻",,,811754246,"[User(ID=294609514, ScreenName=Cath_Tyldesley), User(ID=15308478, ScreenName=itvcorrie), User(ID=86925202, ScreenName=ITV)]",False,1017280993
False,Mon Dec 22 13:27:53 +0000 2008,True,False,MD of a marketing company. Ex Leader of Cambs County Council. Ex military. Ex CEO of tech companies,493,2078,2090,True,en,79,Suffolk,Nick Clarke,C0DEED,http://abs.twimg.com/images/themes/theme1/bg.png,False,https://pbs.twimg.com/profile_banners/18306628/1487008021,http://pbs.twimg.com/profile_images/734122705797144576/bu5r7nn4_normal.jpg,1DA1F2,DDEEF6,333333,False,nickclarkecambs,Thu Feb 08 22:55:36 +0000 2018,"[Hashtag(Text='brexit'), Hashtag(Text='bbcqt')]",en,35519,"RT @TheHappyKipper: #brexit #bbcqt 

SHOCK LATEST BREAKING POLL

Tories now STEAMING AHEAD of traitor, Marxist Labour again

People see the…",London,https://t.co/MjqHMsxDlM,18306628,"[User(ID=3177406031, ScreenName=TheHappyKipper)]",False,1017280993
False,Sat Sep 17 06:29:01 +0000 2016,False,False,Please donate us to support our cause PayPal: ads@insqo.com,8,642,3194,False,en,1,"Lahore, Pakistan",Project Free TV,000000,http://abs.twimg.com/images/themes/theme1/bg.png,False,https://pbs.twimg.com/profile_banners/777031584029536256/1502133947,http://pbs.twimg.com/profile_images/894640585621065728/j0Zn0F5E_normal.jpg,FF691F,000000,000000,False,projectfreetvv,Tue Sep 19 06:04:44 +0000 2017,[],en,21,IDM 6.28 BUILD 17 Serial Key Crack Full Download (100% Working) https://t.co/KGBXJ1TJOY,Pacific Time (US & Canada),https://t.co/562GDKgLSg,777031584029536256,[],False,1017280993
False,Sun Jun 28 13:03:05 +0000 2015,False,False,Former UKIP. Direct Democracy Campaigner. Constitutionalist Views my Own. Retweets are NOT always endorsements.,356,216,280,False,en,1,"Purfleet, Essex",Chris Boosey,000000,http://abs.twimg.com/images/themes/theme1/bg.png,False,https://pbs.twimg.com/profile_banners/3349014155/1506769408,http://pbs.twimg.com/profile_images/961281329982857216/Hp19OS8x_normal.jpg,70147A,000000,000000,True,PurfleetPPP,NaN,NaN,NaN,4159,NaN,,,3349014155,NaN,False,1017280993
False,Sun Jan 29 14:48:03 +0000 2012,False,False,The Twitter site for the UK Independence Party in Sheffield. A re tweet is not an endorsement.,2488,1636,867,False,en,36,Sheffield,SheffieldUKIP,611169,http://pbs.twimg.com/profile_background_images/462004413540749312/8dikYfXB.jpeg,True,https://pbs.twimg.com/profile_banners/477755718/1481844299,http://pbs.twimg.com/profile_images/809541184356044800/VCxtn0qy_normal.jpg,9266CC,DDEEF6,333333,False,SheffieldUKIP,Sun Jan 14 22:49:50 +0000 2018,[],en,5570,The Sheffield branch has had some of the most passionate and hard working campaigners for Ukip &amp; the EU referendum.… https://t.co/zgImXKWlge,Pacific Time (US & Canada),,477755718,[],False,1017280993
False,Sun Oct 12 20:49:23 +0000 2014,True,False,"Loves Yorkshire and all Britain's beautiful coast. #fashion #Designers 
#selfemployed #politics #Brexit",12283,2218,2384,False,en,29,Yorkshire UK,Jennifer W,C0DEED,http://abs.twimg.com/images/themes/theme1/bg.png,False,https://pbs.twimg.com/profile_banners/2826062067/1424599854,http://pbs.twimg.com/profile_images/574555797834739712/r2v_JwLJ_normal.jpeg,1DA1F2,DDEEF6,333333,False,jenny_wren_01,Thu Feb 08 07:41:43 +0000 2018,[],en,5686,"RT @IntThings: Don't use your energy to worry.
Use your energy to create",Pacific Time (US & Canada),,2826062067,"[User(ID=131102007, ScreenName=IntThings)]",False,1017280993
False,Thu Dec 20 16:43:53 +0000 2012,False,False,,3936,596,1230,True,en,27,UK,TheBrexPistol 🇬🇧,000000,http://abs.twimg.com/images/themes/theme1/bg.png,False,https://pbs.twimg.com/profile_banners/1024602439/1517057092,http://pbs.twimg.com/profile_images/957232931600261120/vEoBbzz-_normal.jpg,89C9FA,000000,000000,False,LibertyPurveyor,Wed Feb 07 17:49:37 +0000 2018,[],en,15078,RT @mikelallen6: The EU is now putting in places laws to punish us if we disobey them in the transition period . Negotiations means there i…,Casablanca,,1024602439,"[User(ID=3201162010, ScreenName=mikelallen6)]",False,1017280993
False,Fri Jul 22 08:18:00 +0000 2011,False,False,"Supporting families, Family Law and Child Protection system reform. Training and coaching survivors. Investigating systemic injustice. Raising public awareness.",853,1199,807,False,en,48,UK,Russ Martin,70147A,http://pbs.twimg.com/profile_background_images/523914669199601666/0L1Z66dO.jpeg,False,,http://pbs.twimg.com/profile_images/707631176354304000/qHgbitFa_normal.jpg,70147A,EFEFEF,333333,False,iRussMartin,Thu Feb 08 06:00:26 +0000 2018,[Hashtag(Text='ThursdayMotivation')],en,14058,"#ThursdayMotivation Take action, make mistakes, learn, take action, repeat. Never give up.",,,340181740,[],False,1017280993
False,Sat Sep 17 14:53:24 +0000 2016,True,False,"Father, Christian, Veteran and Patriot. Iraq 2004 - 2006. A Grey Beard who will always stand for what is best for the country..",584,142,1370,False,en,9,"Washington, DC",Quaratine Engineer,F5F8FA,,False,https://pbs.twimg.com/profile_banners/777158520194072576/1477588885,http://pbs.twimg.com/profile_images/777184340228902912/H9IQKrTQ_normal.jpg,1DA1F2,DDEEF6,333333,False,LesDeplorablez,Sat Dec 10 13:57:36 +0000 2016,[],en,2586,@CalliopeAnim Took the oath four times and the left is deemed as domestic enemies and combatants - you never took it or fought,,,777158520194072576,"[User(ID=1968052076, ScreenName=CalliopeAnim)]",False,1017280993
False,Wed Apr 01 08:55:07 +0000 2015,True,False,"Formerly HNC, now just the H part | Swimming Teacher & Lifeguard @activeleisure | 🇬🇧",4351,318,1291,True,en,5,Cleckheaton,James Tuke,C0DEED,http://abs.twimg.com/images/themes/theme1/bg.png,False,https://pbs.twimg.com/profile_banners/3123605131/1498213677,http://pbs.twimg.com/profile_images/803556869767831552/8sl0e0Q__normal.jpg,1DA1F2,DDEEF6,333333,True,james_tuke,NaN,NaN,NaN,1002,NaN,,https://t.co/WPOwWm6fIr,3123605131,NaN,False,1017280993
False,Thu Dec 18 18:47:38 +0000 2014,True,False,,13729,448,3009,False,en,4,,simon247,C0DEED,http://abs.twimg.com/images/themes/theme1/bg.png,False,https://pbs.twimg.com/profile_banners/2930463238/1494186159,http://pbs.twimg.com/profile_images/866888661450805249/c79Pa-tz_normal.jpg,1DA1F2,DDEEF6,333333,False,simon247tweets,Thu Feb 08 16:21:05 +0000 2018,[],en,4671,RT @DouglasCarswell: Rich and powerful people are manoeuvring to try to thwart the referendum result https://t.co/aaaDYAft2J,Pacific Time (US & Canada),,2930463238,"[User(ID=25097735, ScreenName=DouglasCarswell)]",False,1017280993
False,Fri Feb 05 07:04:32 +0000 2016,True,False,Very partial to bacon and beer. Islamization of the West is real. Wake up.,1778,408,674,False,en-GB,47,,Fat Lip,F5F8FA,,False,https://pbs.twimg.com/profile_banners/4877444500/1514020105,http://pbs.twimg.com/profile_images/934091014712774658/z5uJTFBv_normal.jpg,1DA1F2,DDEEF6,333333,False,Itchi_Fanny,Thu Feb 08 22:00:49 +0000 2018,[Hashtag(Text='MagicFairies')],en,36310,RT @MarcherLord1: Religion - it’s a mental illness. #MagicFairies https://t.co/66H1XI7woM,,,4877444500,"[User(ID=492034711, ScreenName=MarcherLord1)]",False,1017280993
False,Thu Apr 07 12:26:04 +0000 2016,True,False,THE HERO CONSERVATISM NEEDS!!,1330,58,605,False,en-GB,1,,Conservative Batman,F5F8FA,,False,https://pbs.twimg.com/profile_banners/718052220428808193/1460033805,http://pbs.twimg.com/profile_images/883946314442063872/Mt5ZLg-H_normal.jpg,1DA1F2,DDEEF6,333333,False,ConserveBatman,Thu Feb 08 16:24:47 +0000 2018,[],en,1256,@darrengrimes_ @faisalislam @Jacob_Rees_Mogg Here is a politician with no prep genuinely and intelligently answerin… https://t.co/X7zDqxMlST,,,718052220428808193,"[User(ID=4691437897, ScreenName=darrengrimes_), User(ID=22812734, ScreenName=faisalislam), User(ID=885838630928994304, ScreenName=Jacob_Rees_Mogg)]",False,1017280993
False,Tue Mar 22 12:17:28 +0000 2011,False,False,Libertarian/#BREXIT/Freespeech/#FLA #Democracy/#onelawforall/controlled immigration //ProEurope/Anti Eu/Patriot 🇬🇧🇺🇸#stablegenius #leavewithoutadeal,48657,7928,5406,False,en,99,,Nigella,000000,http://abs.twimg.com/images/themes/theme1/bg.png,False,https://pbs.twimg.com/profile_banners/270327100/1516994349,http://pbs.twimg.com/profile_images/947603325393960961/0He2kQpU_normal.jpg,F5ABB5,000000,000000,False,Lou_i5e,Thu Feb 08 23:44:01 +0000 2018,[],en,72452,RT @Mate_Britain: Hi to those who follow me. Please spread the word and ask others to follow me on twitter. I am a ex muslim and need a mas…,,,270327100,"[User(ID=1453424635, ScreenName=Mate_Britain)]",False,1017280993
False,Sun Dec 30 17:28:16 +0000 2012,True,False,"UKIP Scarborough & Whitby Branch.
Interim Chairman of Steering Committee for future team of Yorkshire & North East Lincs Region.
ken.hordon@ukip.org",4290,407,412,True,en,21,"Whitby, North Yorkshire",Ken Hordon,C0DEED,http://abs.twimg.com/images/themes/theme1/bg.png,False,,http://pbs.twimg.com/profile_images/3051806727/1f91cc9cfb0f343dd6721d76fbd80497_normal.jpeg,1DA1F2,DDEEF6,333333,False,kenhordonukip,Thu Feb 08 22:31:45 +0000 2018,[Hashtag(Text='UKIP')],en,9731,"#UKIP have every genuine intention of going against Labour but ex members, Brexiteers need to realise our Constitut… https://t.co/ZtNDJYma64",,https://t.co/d0ihtdEtwy,1048409659,[],False,1017280993
False,Mon May 26 12:32:09 +0000 2014,False,False,"Former @UKIP cand. for Beechwood 2017 & 2016 WA for Monmouth. Faragist, Co.Dir. Pro: #Brexit & Libertarianism. Anti: EU, PC, discrimination & unfairness.",16540,535,669,True,en,35,"Newport, S.Wales",Tim Price,000000,http://abs.twimg.com/images/themes/theme1/bg.png,False,https://pbs.twimg.com/profile_banners/2565200307/1480929447,http://pbs.twimg.com/profile_images/905941296208076801/p7u2lRlX_normal.jpg,981CEB,000000,000000,False,timpy32001,Thu Feb 08 23:38:10 +0000 2018,[],en,15402,"RT @Insurance_Rich: Emily Thornberry is, in the end, arguing for communism. Doctors get the same pay as shop workers who get the same pay a…",,,2565200307,"[User(ID=704689426774020097, ScreenName=Insurance_Rich)]",False,1017280993
False,Thu Jan 24 22:26:58 +0000 2013,False,False,"'I have a dream, shared by millions, that one day our children will live free in a independent, democratic nation called the United Kingdom'",723,2280,2200,True,en,59,UK NOT EU,Geoff,642D8B,http://pbs.twimg.com/profile_background_images/872412018/947f0d9dcf7dcd3c191f1a11d5526407.png,False,https://pbs.twimg.com/profile_banners/1117901695/1451738663,http://pbs.twimg.com/profile_images/948652012610183168/6q2h5YEK_normal.jpg,FF0000,7AC3EE,3D1957,True,geoffLeaveEU,NaN,NaN,NaN,23692,NaN,,,1117901695,NaN,False,1017280993
False,Sun Jan 22 15:13:04 +0000 2012,True,False,,13498,1259,2982,False,en,42,,onlywayisup,C0DEED,http://abs.twimg.com/images/themes/theme1/bg.png,False,,http://pbs.twimg.com/profile_images/922363949068292096/5K857rwV_normal.jpg,1DA1F2,DDEEF6,333333,False,mark1854now,Thu Feb 08 20:15:56 +0000 2018,[],en,27088,"RT @LuciHoneychurch: @robertbirsinger @ShaniDavis @TeamUSA If not a coin toss, what method would you suggest?  ""Guess a number?""  ""Draw str…",Dublin,,471150546,"[User(ID=1347943243, ScreenName=LuciHoneychurch), User(ID=840456230, ScreenName=robertbirsinger), User(ID=110985688, ScreenName=ShaniDavis), User(ID=21870081, ScreenName=TeamUSA)]",False,1017280993
False,Wed Oct 29 18:49:43 +0000 2014,True,False,,1901,69,910,False,en-GB,0,London,Alan Kunna,C0DEED,http://abs.twimg.com/images/themes/theme1/bg.png,False,https://pbs.twimg.com/profile_banners/2882503189/1460807821,http://pbs.twimg.com/profile_images/721306724335022080/A4BpS0x2_normal.jpg,1DA1F2,DDEEF6,333333,True,ErikTheUnready,NaN,NaN,NaN,63,NaN,,,2882503189,NaN,False,1017280993
False,Mon Dec 29 22:05:57 +0000 2014,True,False,I can't remember following those I'm supposed to be following...,18,11,66,False,en-gb,0,,Bryan Gibbons,C0DEED,http://abs.twimg.com/images/themes/theme1/bg.png,False,,http://pbs.twimg.com/profile_images/954653461873872896/bvnRcyKg_normal.jpg,1DA1F2,DDEEF6,333333,False,greyhoundman2,Sun Jan 28 18:25:06 +0000 2018,[],en,43,RT @greyhoundtrust: On Monday MPs will debate the use of fireworks. We are supporting the petition of the Firework Abatement Campaign to se…,Pacific Time (US & Canada),,2950095983,"[User(ID=194600775, ScreenName=greyhoundtrust)]",False,1017280993
False,Fri Apr 01 09:26:48 +0000 2011,False,False,"London Assembly Member. Councillor for Hatch End,London Borough Harrow. Member of LFEPA. Thoughts and comments my own. susanmaryhall@gmail.com",966,2165,1361,True,en,40,Harrow-London,Susan Hall AM,C0DEED,http://abs.twimg.com/images/themes/theme1/bg.png,False,https://pbs.twimg.com/profile_banners/275455326/1497966371,http://pbs.twimg.com/profile_images/2800798096/015e825f079af284419c6b9f8eac9829_normal.jpeg,7700B3,DDEEF6,333333,False,Councillorsuzie,Thu Feb 08 11:29:56 +0000 2018,[],en,13763,The wonderful Peter Golds @going4golds and I at City Hall yesterday before the committee meeting looking at how the… https://t.co/cwIn4MsdUD,,,275455326,"[User(ID=3252797435, ScreenName=going4golds)]",False,1017280993
False,Sun Mar 20 15:55:27 +0000 2011,False,False,"Love Cricket, Football - Chelsea and Tennis - Enjoy politics travel and entrepreneurism, singer song writers, live music, gardening and interiors",19590,1988,3115,True,en,81,London City of The World,Wendy D,000000,http://abs.twimg.com/images/themes/theme1/bg.png,False,https://pbs.twimg.com/profile_banners/269346463/1513719928,http://pbs.twimg.com/profile_images/578313343041175552/IXOfH_QG_normal.jpeg,981CEB,000000,000000,False,wendyjaned,Thu Feb 08 22:33:09 +0000 2018,[],en,12591,@JimHanner @Plug_em Very good I watched it through the screeching x,,,269346463,"[User(ID=14097603, ScreenName=JimHanner), User(ID=3172647555, ScreenName=Plug_em)]",False,1017280993
