contributors_enabled,created_at,default_profile,default_profile_image,description,favourites_count,followers_count,friends_count,geo_enabled,lang,listed_count,location,name,profile_background_color,profile_background_image_url,profile_background_tile,profile_banner_url,profile_image_url,profile_link_color,profile_sidebar_fill_color,profile_text_color,protected,screen_name,status_created_at,status_hashtags,status_lang,statuses_count,text,time_zone,url,user_id,user_mentions,verified,follows_subject
False,Mon Feb 09 13:27:07 +0000 2015,True,False,"UKIP activist & a ‘no deal leave now’ Brexiteer, I don’t wanna be British I wanna be ENGLISH!",426,45,84,False,en-gb,0,"Sutton, London",Julie Beach,C0DEED,http://abs.twimg.com/images/themes/theme1/bg.png,False,https://pbs.twimg.com/profile_banners/3026492080/1516564356,http://pbs.twimg.com/profile_images/916384936055263232/0Ptd2CP5_normal.jpg,1DA1F2,DDEEF6,333333,False,Julesabeach,Mon Feb 05 23:07:35 +0000 2018,[],en,426,"RT @KurlyKrissy: How dare you! You chose to publicly announce your relationship to the world, unbeknown to your wife!! Your 25 year old mis…",,,3026492080,"[User(ID=577055614, ScreenName=KurlyKrissy)]",False,1017280993
False,Fri Sep 16 19:08:44 +0000 2016,True,True,,1,35,1268,False,en,1,,Mickstevenson,F5F8FA,,False,,http://abs.twimg.com/sticky/default_profile_images/default_profile_normal.png,1DA1F2,DDEEF6,333333,False,Mickstevenson41,NaN,NaN,NaN,0,NaN,,,776860387174219776,NaN,False,1017280993
False,Sun Apr 24 11:41:16 +0000 2011,True,True,,31500,162,801,False,en,10,Essex,HYUFD,C0DEED,http://abs.twimg.com/images/themes/theme1/bg.png,False,,http://abs.twimg.com/sticky/default_profile_images/default_profile_normal.png,1DA1F2,DDEEF6,333333,False,HYUFD1,Thu Feb 08 23:22:15 +0000 2018,[],en,24116,"@bargainplaceuk @adamrickitt @ITVGranadaTV Some are, some aren't, many do long hours working for their constituents… https://t.co/59oFeKTqvK",,,287137520,"[User(ID=88080618, ScreenName=bargainplaceuk), User(ID=106397785, ScreenName=adamrickitt), User(ID=187111193, ScreenName=ITVGranadaTV)]",False,1017280993
False,Sun Jun 19 06:12:51 +0000 2016,True,False,"1 It's not the EU we have to worry about; it's our own government that took us in unilaterally and wants to keep us in.
2 We need PR.
3 Not a fan of socialism.",19713,361,245,False,en,21,,outdammit,F5F8FA,,False,,http://pbs.twimg.com/profile_images/804397523666370560/64T8nPgC_normal.jpg,1DA1F2,DDEEF6,333333,False,br3xitnow,Thu Feb 08 21:22:45 +0000 2018,[],en,31323,RT @V_of_Europe: Here's why the West is dying https://t.co/v9yNmyqOIP,,,744412608413995008,"[User(ID=4717892303, ScreenName=V_of_Europe)]",False,1017280993
False,Tue May 31 17:11:59 +0000 2016,True,True,,14218,164,145,False,en-gb,5,,Clair Grimes,F5F8FA,,False,,http://abs.twimg.com/sticky/default_profile_images/default_profile_normal.png,1DA1F2,DDEEF6,333333,False,clair_grimes,Thu Feb 08 19:17:29 +0000 2018,[],en,13420,@LBC @Nigel_Farage This Soros guy wants Europe to take millions of migrants  For the sake of our future generation… https://t.co/dITpqDqRb2,London,,737693116753453056,"[User(ID=20973388, ScreenName=LBC), User(ID=19017675, ScreenName=Nigel_Farage)]",False,1017280993
False,Wed Oct 14 10:15:26 +0000 2015,False,False,"Libertarian, voted for, campaigned for and support BREXIT. UKIP. hate lefties and the Labour Party. my views are my own and not on behalf of any political party",10172,1545,2271,True,en,17,"North West, England",SUE,000000,http://abs.twimg.com/images/themes/theme10/bg.gif,False,https://pbs.twimg.com/profile_banners/3954973528/1500922647,http://pbs.twimg.com/profile_images/889560168027082754/T4s4uLq6_normal.jpg,981CEB,000000,000000,False,SueLeah3,Tue Feb 06 23:19:47 +0000 2018,[],en,11941,RT @StefanMolyneux: Of course late night comedians are liberals. Conservatives have to get up for work.,London,,3954973528,"[User(ID=313038011, ScreenName=StefanMolyneux)]",False,1017280993
False,Mon Jul 25 14:30:47 +0000 2016,True,False,,8105,97,166,False,en-gb,0,,psibernaut,F5F8FA,,False,,http://pbs.twimg.com/profile_images/757584772625555456/9gadzwCi_normal.jpg,1DA1F2,DDEEF6,333333,False,psibernaut,Thu Feb 08 19:14:54 +0000 2018,[Hashtag(Text='Irexit')],en,8827,"RT @Lamh_Dearg: https://t.co/xCrSb1VZLA

#Irexit conference panel discusses traitors the late unlamented Peter Sutherland and foreign intri…",London,,757583880165662720,"[User(ID=758920848, ScreenName=Lamh_Dearg)]",False,1017280993
False,Sat Dec 21 22:09:18 +0000 2013,True,False,USA UK Israel Russia Ukraine Syria Politics Medicine,71617,1595,4950,False,en-gb,250,,esme,C0DEED,http://abs.twimg.com/images/themes/theme1/bg.png,False,,http://pbs.twimg.com/profile_images/414521012999303168/dWLRSTTR_normal.jpeg,1DA1F2,DDEEF6,333333,False,esme35975435,Thu Feb 08 16:48:37 +0000 2018,[],en,106015,RT @ArlieAgain: @DineshDSouza I don’t know how this will turn out...but I spent my whole life associated with The United States Army thru m…,Adelaide,,2256982358,"[User(ID=911647143449968640, ScreenName=ArlieAgain), User(ID=91882544, ScreenName=DineshDSouza)]",False,1017280993
False,Wed Apr 01 22:28:21 +0000 2009,False,False,"Atlanticist, conservative, libertarian supporter of British independence.  Executive Board - Conservative Way Forward.",59,1365,4835,False,en,33,London,Steve Stanbury,000000,http://abs.twimg.com/images/themes/theme1/bg.png,False,https://pbs.twimg.com/profile_banners/28213620/1434005606,http://pbs.twimg.com/profile_images/608889607284006912/9RJQxY4U_normal.jpg,992299,000000,000000,False,StanburySteven,Mon Jan 29 00:31:01 +0000 2018,[],en,594,@Claire Perry MP is a classic example of a Tory MP utterly out of touch with her party and the will of the majority… https://t.co/NuFg0WFsBw,London,,28213620,"[User(ID=59003, ScreenName=Claire)]",False,1017280993
False,Sat Sep 03 02:26:00 +0000 2016,True,False,"At ChainLink, we aim to provide the public with a source that will inform, not push an agenda; encourage public conversation instead of shut it down.",637,549,1542,False,en,0,The World,ChainLink News,F5F8FA,,False,https://pbs.twimg.com/profile_banners/771896998257504257/1472870790,http://pbs.twimg.com/profile_images/776284177758982145/QwRK-eMD_normal.jpg,1DA1F2,DDEEF6,333333,False,ChainLinknews,Mon Feb 05 15:43:28 +0000 2018,[],en,1027,"RT @PrisonPlanet: Jacob Rees-Mogg for Prime Minister.

Retweet if you agree.",Pacific Time (US & Canada),https://t.co/2tFrybwX2J,771896998257504257,"[User(ID=18643437, ScreenName=PrisonPlanet)]",False,1017280993
False,Tue Jun 28 18:56:12 +0000 2016,True,False,,8042,1593,2326,True,en-gb,0,"NW England, Europe (not EU) ",MuddyBoots 🇬🇧🇵🇱,F5F8FA,,False,https://pbs.twimg.com/profile_banners/747866205822849024/1511806610,http://pbs.twimg.com/profile_images/747869246575763456/TNevPMo8_normal.jpg,1DA1F2,DDEEF6,333333,False,Muddypumpkin,Thu Feb 08 23:01:38 +0000 2018,[Hashtag(Text='Soros')],en,4330,RT @davidmweissman: You do realize #Soros was a Nazi collaborator who turned in fellow Jews to them right? https://t.co/avAegh7FXM,,,747866205822849024,"[User(ID=880018682, ScreenName=davidmweissman)]",False,1017280993
False,Tue Mar 08 16:54:57 +0000 2011,True,False,ICO investment enthusiast #blockchain #bitcoin #ICO #ethereum see @ICOFormula,10830,761,1061,True,en,17,"London, England",Lee,C0DEED,http://abs.twimg.com/images/themes/theme1/bg.png,False,https://pbs.twimg.com/profile_banners/262729840/1482055205,http://pbs.twimg.com/profile_images/954749380023717889/EcEFVMhH_normal.jpg,1DA1F2,DDEEF6,333333,False,lee_branch,Wed Feb 07 10:40:07 +0000 2018,"[Hashtag(Text='Bitcoin'), Hashtag(Text='MoonTime')]",en,7098,RT @BitcoinUKs: #Bitcoin #MoonTime as the positive news stories flow in today and the world is starting to wake up to Bitcoin and the advan…,,,262729840,"[User(ID=852812552765448192, ScreenName=BitcoinUKs)]",False,1017280993
False,Tue Dec 07 22:57:00 +0000 2010,True,False,Great Britain formally part of the EU Superstate. RT's are not endorsements. Followed by @Jongaunt - A totally gluten free experience.,14080,858,2535,False,en,26,,See E.U. later,C0DEED,http://abs.twimg.com/images/themes/theme1/bg.png,False,https://pbs.twimg.com/profile_banners/224012685/1515495516,http://pbs.twimg.com/profile_images/941209476169912320/92ZD-UYd_normal.jpg,1DA1F2,DDEEF6,333333,False,Stressed_Al,Thu Feb 08 22:55:38 +0000 2018,[],en,17854,RT @ShaunLintern: In the wake of today's news....Should NHS managers like CEOs be subject to formal regulation like doctors &amp; nurses so the…,,,224012685,"[User(ID=162071541, ScreenName=ShaunLintern)]",False,1017280993
False,Fri Jun 26 09:02:23 +0000 2009,True,False,Licensed London Taxi Driver (GB). Should've paid more attention in school. Probably sat in traffic.,6596,2378,2450,True,en,30,Essex/London,Simon,C0DEED,http://abs.twimg.com/images/themes/theme1/bg.png,False,https://pbs.twimg.com/profile_banners/50985375/1468762787,http://pbs.twimg.com/profile_images/798875563045830656/-pXju2_M_normal.jpg,1DA1F2,DDEEF6,333333,False,simon_taxi,Thu Feb 08 18:06:25 +0000 2018,[],en,12973,How did this person get a licence to drive the public from @TfLTPH with those previous convictions???? https://t.co/RDFC0XlHUi,Amsterdam,https://t.co/kseXnbzlq8,50985375,"[User(ID=538103919, ScreenName=TfLTPH)]",False,1017280993
False,Mon Jun 16 17:48:19 +0000 2014,True,False,"Cynical. ... who me????.......Never
Very proud #Brexit voter... Looking forward to a future outside of eu.",4908,445,1098,True,en,10,,Dave Jones,C0DEED,http://abs.twimg.com/images/themes/theme1/bg.png,False,https://pbs.twimg.com/profile_banners/2614810163/1498740216,http://pbs.twimg.com/profile_images/854644648329043968/4AUGdtzv_normal.jpg,1DA1F2,DDEEF6,333333,False,foxtrotoscar007,Thu Feb 08 22:47:00 +0000 2018,[],en,5599,RT @DVATW: Here’s a great read! Please RT it - it calls you ANTIFA for what they are - terrorists. https://t.co/uIWfQqZpYk,,,2614810163,"[User(ID=19899606, ScreenName=DVATW)]",False,1017280993
False,Fri Apr 08 20:09:39 +0000 2016,True,False,,2,5,8,False,en,0,,Pete,F5F8FA,,False,,http://pbs.twimg.com/profile_images/719842992274739200/hMYH-x3S_normal.jpg,1DA1F2,DDEEF6,333333,False,londonphototaxi,Sat Dec 16 15:10:32 +0000 2017,[],en,11,"@thomasthetaxi @heidijukes Jim, the tech is built in to the iphone already https://t.co/rZkzE712FW",,,718531271903821824,"[User(ID=28272361, ScreenName=thomasthetaxi), User(ID=843665742, ScreenName=heidijukes)]",False,1017280993
False,Sat Sep 03 00:54:02 +0000 2016,True,False,,0,7,212,False,en,0,Shanghai,Farrah,F5F8FA,,False,https://pbs.twimg.com/profile_banners/771873855392460800/1472868663,http://pbs.twimg.com/profile_images/771878289082155011/Uh5F-x04_normal.jpg,1DA1F2,DDEEF6,333333,False,chengdu_farrah,Wed Sep 07 06:39:13 +0000 2016,[],und,3,https://t.co/r29dUtxeHW,,,771873855392460800,[],False,1017280993
False,Sat Jan 16 00:15:28 +0000 2010,False,False,I live in the UK and I'm enjoying it very much.,713,710,2293,False,en,14,United Kingdom,Aabid,131516,http://pbs.twimg.com/profile_background_images/524361087903227904/WMALnzRY.jpeg,False,https://pbs.twimg.com/profile_banners/105306846/1510081442,http://pbs.twimg.com/profile_images/927974943207383042/ZCNEPD2l_normal.jpg,1B95E0,000000,000000,False,wizardbird,Fri Jan 05 23:04:16 +0000 2018,[],en,4348,@theEUsnot4us @BrexiteerGB Hope you cleaned yourself up OK.,London,,105306846,"[User(ID=2269206625, ScreenName=theEUsnot4us), User(ID=2891922856, ScreenName=BrexiteerGB)]",False,1017280993
False,Sat May 21 13:23:15 +0000 2011,False,False,Support women born in the 1950's. WASPI. 1950's women have been treated unfairly with the pension changes in 1995 and 2011.,5852,2365,1786,False,en,22,Hertfordshire,Linda,C0DEED,http://abs.twimg.com/images/themes/theme1/bg.png,False,,http://pbs.twimg.com/profile_images/568726650527830016/pvVKFUwf_normal.jpeg,981CEB,DDEEF6,333333,False,Linda1258,Thu Feb 08 18:19:49 +0000 2018,[],en,1858,"RT @MoggMentum: Jacob Rees-Mogg has become the perfect politician for our confused times. ""His calm, dignity and conviction sets him above…",Pacific Time (US & Canada),,302606042,"[User(ID=874376431949795330, ScreenName=MoggMentum)]",False,1017280993
False,Mon Aug 02 19:23:52 +0000 2010,False,False,"I studied Remote Sensing & GIS, I also have great skill in translating Chinese. have integrity in all you do, light reveals darkness, and love wins",769,670,4881,True,en,9,"Texas, USA",King Muffy,000000,http://abs.twimg.com/images/themes/theme1/bg.png,False,https://pbs.twimg.com/profile_banners/173952412/1504631515,http://pbs.twimg.com/profile_images/761703651211632640/ZNMF_guw_normal.jpg,E81C4F,000000,000000,False,KingMuffy_E,Sun Feb 04 17:50:54 +0000 2018,[],und,1555,@jperkovic93 😏,Central Time (US & Canada),https://t.co/xaZaqxECCz,173952412,"[User(ID=282348037, ScreenName=jperkovic93)]",False,1017280993
False,Wed Sep 11 16:48:06 +0000 2013,False,False,Anti-PC; mansplainer; British and English; libertarian; small government; low taxes. UKIP member.,8062,902,1247,False,en-gb,6,Britannia,Pauly's UKIP,000000,http://abs.twimg.com/images/themes/theme1/bg.png,False,https://pbs.twimg.com/profile_banners/1854824490/1512898573,http://pbs.twimg.com/profile_images/915698954066628609/MhKuXXWe_normal.jpg,1B95E0,000000,000000,False,royzoraprisleon,Thu Feb 08 23:00:38 +0000 2018,[Hashtag(Text='ukip')],en,9983,RT @Billukip: I urge all members of #ukip get to Birmingham for the EGM and remove Bolton. Don’t just assume it’s going to happen because h…,Pacific Time (US & Canada),,1854824490,"[User(ID=155704077, ScreenName=Billukip)]",False,1017280993
False,Wed May 28 22:47:49 +0000 2014,False,False,"To strive, to seek, to find, and not to yield  #Republican #Libertarian #Nationalist . Your rights end, where the other persons begin. #MAGA #TRUMP/PENCE 2016",58048,9401,5566,False,en,40,"Idaho, USA",Daniel March,000000,http://abs.twimg.com/images/themes/theme1/bg.png,False,https://pbs.twimg.com/profile_banners/2531015528/1486574368,http://pbs.twimg.com/profile_images/471788144585486336/cRCxG9Na_normal.jpeg,1B95E0,000000,000000,False,TheDanielMarch,Thu Feb 08 22:12:19 +0000 2018,[],en,36119,RT @KateHoeyMP: Perhaps you might like to have a word with those holding EU flags outside Parliament who come right up close to anyone iden…,,,2531015528,"[User(ID=1284146730, ScreenName=KateHoeyMP)]",False,1017280993
False,Thu Feb 25 13:20:36 +0000 2016,False,False,,2,59,56,False,en,8,"Shaftesbury, England",lester-taylor,000000,http://abs.twimg.com/images/themes/theme1/bg.png,False,,http://pbs.twimg.com/profile_images/705420939824078849/ZC2HCTT6_normal.jpg,981CEB,000000,000000,False,lestertaylor9,Thu Feb 08 19:26:33 +0000 2018,[],en,525,To Get a Good Brexit Deal We Must Prepare for No Deal! (Video.) - https://t.co/kOax4mEw9o,,https://t.co/BrlDNGXe9t,702845652607352832,[],False,1017280993
False,Sat Mar 22 08:03:11 +0000 2014,False,False,Moderate blue collar Conservative | Fan of Brexit | Seasoned campaigner | Reads Machiavelli too much | Bristol | QEH,426,476,1224,True,en,14,"England, United Kingdom",Edward A. Píška,000000,http://abs.twimg.com/images/themes/theme1/bg.png,False,https://pbs.twimg.com/profile_banners/2428475723/1513849847,http://pbs.twimg.com/profile_images/943781074445983744/I8vIlJl0_normal.jpg,1B95E0,000000,000000,True,EdPiska,NaN,NaN,NaN,122,NaN,Pacific Time (US & Canada),,2428475723,NaN,False,1017280993
False,Sat Oct 24 14:06:29 +0000 2009,False,False,"Si vis pacem para bellum. Couldn't be more #Brexity. Not fond of the Left. Change is inevitable, except from a vending machine. Love @cybulskab and my kids. P9.",8024,1553,3079,True,en,48,Probably in a car. Somewhere.,Gobshite feat. Brexit,131516,http://pbs.twimg.com/profile_background_images/653628959/ftm4dzk8p6adrr6lxdig.jpeg,False,https://pbs.twimg.com/profile_banners/84855412/1425841286,http://pbs.twimg.com/profile_images/949410156835721216/xR1t8Bfw_normal.jpg,ABB8C2,EFEFEF,333333,False,tonywonderfire,Thu Feb 08 23:11:29 +0000 2018,[],en,45881,RT @MrHarryCole: Rather odd to have Shadow Cabinet members second jobbing: https://t.co/TVCf5sPeHV,Europe/London,,84855412,"[User(ID=15348883, ScreenName=MrHarryCole)]",False,1017280993
False,Wed Jan 21 12:50:10 +0000 2015,False,False,Blade. Concerned at the demise of a once great country.,24473,2202,2375,False,en-gb,20,Sheffield,John Reeves,000000,http://abs.twimg.com/images/themes/theme1/bg.png,False,,http://pbs.twimg.com/profile_images/598441742199816193/_k1VLXLA_normal.jpg,DD2E44,000000,000000,False,ReevesJek,Thu Feb 08 13:07:15 +0000 2018,[],en,20071,RT @2010LeeHurst: @JuliaHB1 @Jacob_Rees_Mogg apparently tried to calm them down when he could've dispersed them more efficiently with the t…,,,2989776491,"[User(ID=141269460, ScreenName=2010LeeHurst), User(ID=459390022, ScreenName=JuliaHB1), User(ID=885838630928994304, ScreenName=Jacob_Rees_Mogg)]",False,1017280993
False,Sat Nov 22 12:23:54 +0000 2014,False,False,,6709,175,254,False,en,11,taking on one bullshitter at a time,jimmy,000000,http://abs.twimg.com/images/themes/theme1/bg.png,False,https://pbs.twimg.com/profile_banners/2887798685/1486588027,http://pbs.twimg.com/profile_images/842469723484884994/UOfXrU7Q_normal.jpg,888899,000000,000000,False,mebloodclart,Fri Dec 29 06:51:56 +0000 2017,[],en,17831,@lucyfrown no barriers or armed police,London,,2887798685,"[User(ID=1050861391, ScreenName=lucyfrown)]",False,1017280993
False,Tue Mar 09 21:13:39 +0000 2010,True,False,"I'm a corporal in 1RRF, got three fantastic children & I support three-in-a-row title winning Chester FC. First season as a ST holder.",1348,432,1617,True,en,0,"Bolton, England",Joe Cureton,C0DEED,http://abs.twimg.com/images/themes/theme1/bg.png,False,https://pbs.twimg.com/profile_banners/121547926/1402684057,http://pbs.twimg.com/profile_images/751928541877534720/bYAU7OrH_normal.jpg,1DA1F2,DDEEF6,333333,False,joecureton,Thu Feb 08 17:18:17 +0000 2018,[],en,2433,If anyone can clarify why I’ve been included here I’d appreciate it 🤔🤷‍♂️ https://t.co/oBqjOXUDbi,,,121547926,[],False,1017280993
False,Tue Apr 10 20:23:10 +0000 2012,False,False,🏴󠁧󠁢󠁥󠁮󠁧󠁿 My national identity is English.Voted to leave the EEC in 1975 & 2016.England has no constitutional presence & the English are grossly under represented,5099,1038,1723,False,en,40,Al Bion,Alan England #FBAE,C0DEED,http://pbs.twimg.com/profile_background_images/456365311680200705/OTrQHFE6.jpeg,False,,http://pbs.twimg.com/profile_images/806670300914008064/8LOG1xQI_normal.jpg,E81C4F,DDEEF6,333333,False,AlanEngland4,Thu Feb 08 20:34:09 +0000 2018,[],en,32467,2 people followed me today tracked by https://t.co/LV23RjvKei,London,http://t.co/0e0ivCTC3G,550417741,[],False,1017280993
False,Sun May 17 10:44:04 +0000 2009,True,False,Let's mock leftists...,10159,353,610,False,en,33,Pontypandy,Fireman Pepe,C0DEED,http://abs.twimg.com/images/themes/theme1/bg.png,False,https://pbs.twimg.com/profile_banners/40641094/1480756233,http://pbs.twimg.com/profile_images/833592242954661888/FT-_z-0-_normal.jpg,1DA1F2,DDEEF6,333333,False,twooor,Mon Feb 20 10:43:47 +0000 2017,[],und,9983,@CNN https://t.co/SXfruvy7qP,Brisbane,,40641094,"[User(ID=759251, ScreenName=CNN)]",False,1017280993
False,Fri Sep 09 00:39:40 +0000 2016,True,False,...,332,33,294,False,en-gb,1,"Seven Sisters/Tottenham, Haringey, Middlesex, London, England",Janus Polenceusz,F5F8FA,,False,https://pbs.twimg.com/profile_banners/774044564554391552/1495234082,http://pbs.twimg.com/profile_images/865705616861347840/x9SAD5jW_normal.jpg,1DA1F2,DDEEF6,333333,False,JanusPolenceusz,Sat Jan 13 18:01:29 +0000 2018,[],en,314,Petition: Leave the EU immediately https://t.co/kqrhjyEHjV,,https://t.co/2ETZmm7ewW,774044564554391552,[],False,1017280993
False,Thu Mar 10 13:46:19 +0000 2016,True,False,,19,462,1179,False,en-gb,6,,deep underground uk,F5F8FA,,False,https://pbs.twimg.com/profile_banners/707925555727966208/1457788954,http://pbs.twimg.com/profile_images/708643875825573888/MFpq8mPo_normal.jpg,1DA1F2,DDEEF6,333333,False,deepunderuk1,Thu Sep 08 13:34:56 +0000 2016,[],en,10723,@jamesyuill Next Infinity 10.09.16 Tickets: https://t.co/oIJw7g66tl,,,707925555727966208,"[User(ID=22988674, ScreenName=jamesyuill)]",False,1017280993
False,Sun Feb 24 11:44:56 +0000 2013,False,False,Strange but Interesting.,252,111,487,True,en,7,U.K.,Dave the Hippo,000000,http://abs.twimg.com/images/themes/theme1/bg.png,False,https://pbs.twimg.com/profile_banners/1215261590/1499246363,http://pbs.twimg.com/profile_images/882529320618602496/W4_2CzAa_normal.jpg,981CEB,000000,000000,False,hippopootermus,Wed Jan 10 22:39:44 +0000 2018,[],en,1,@DRUDGE_REPORT How wonderful for civilization. Lucky women!,London,https://t.co/U7cJorrGVe,1215261590,"[User(ID=14669951, ScreenName=DRUDGE_REPORT)]",False,1017280993
False,Sat May 14 17:11:11 +0000 2011,False,False,"Little Englander, Gun Nut, Pro: Free-Speech, Police-State, Austerity, Drug-Legalization, Brexit, UNxit, Geneva Convexit, Body-shaming, Fortress-Europe.",10788,687,1876,False,en,7,,I LIKE TURTLES,000000,http://abs.twimg.com/images/themes/theme1/bg.png,False,https://pbs.twimg.com/profile_banners/298630782/1515093858,http://pbs.twimg.com/profile_images/948998461969616896/7HEx7ln6_normal.jpg,981CEB,000000,000000,False,EdSmith8,Tue Feb 06 22:54:37 +0000 2018,[],en,3055,RT @MsBlaireWhite: Coming out as transgender was infinitely easier for me than coming out as a conservative.,,,298630782,"[User(ID=4316769252, ScreenName=MsBlaireWhite)]",False,1017280993
False,Wed Apr 29 22:17:42 +0000 2015,True,False,"29, Engineer, physics & maths nerd, pirate, ps4 & gaming lover, gym, lifting.",44312,159,193,False,en,1,"Oldham, England",Lloyd dennison,C0DEED,http://abs.twimg.com/images/themes/theme1/bg.png,False,https://pbs.twimg.com/profile_banners/3222374519/1478309114,http://pbs.twimg.com/profile_images/794711145974288384/Zf_ye9uY_normal.jpg,1DA1F2,DDEEF6,333333,False,lloyd_dennison,Tue Feb 06 16:24:53 +0000 2018,[],und,2615,@NYTScience @IanAdAstra @AmandaEdmunds5,,,3222374519,"[User(ID=1435461, ScreenName=NYTScience), User(ID=289322631, ScreenName=IanAdAstra), User(ID=743974515814895616, ScreenName=AmandaEdmunds5)]",False,1017280993
False,Tue Mar 15 15:35:07 +0000 2016,False,False,"Former UKIP Sussex Police & Crime Commissioner candidate 2016, PPC 2017 and local businessman. My views are my own.",90,163,361,False,en,10,United Kingdom,Patrick Lowe,000000,http://abs.twimg.com/images/themes/theme1/bg.png,False,https://pbs.twimg.com/profile_banners/709764871655661568/1470158258,http://pbs.twimg.com/profile_images/918125892475478019/F9ClcewN_normal.jpg,1B95E0,000000,000000,False,patrickloweukip,Fri Jan 19 23:18:35 +0000 2018,[],en,185,"@Lou_i5e @Nigel_Farage Nigella, DM got their facts wrong. Susie wasn’t Henry Bolton’s Campaign manager. I was and I… https://t.co/t1hGPYaZE3",London,,709764871655661568,"[User(ID=270327100, ScreenName=Lou_i5e), User(ID=19017675, ScreenName=Nigel_Farage)]",False,1017280993
False,Fri Nov 02 08:17:03 +0000 2012,True,True,,94,55,240,True,en,2,,Raymond smyth,C0DEED,http://abs.twimg.com/images/themes/theme1/bg.png,False,,http://abs.twimg.com/sticky/default_profile_images/default_profile_normal.png,1DA1F2,DDEEF6,333333,False,SmythRaysmy1964,Fri Feb 02 12:22:44 +0000 2018,[Hashtag(Text='TheWho')],en,134,"RT @GreatestCapital: #TheWho in shepherds Bush market. Shepherds Bush, one of the best areas in London to grow up in the 60s and 70s, Best…",,,920585472,"[User(ID=217498355, ScreenName=GreatestCapital)]",False,1017280993
False,Sun Jun 26 10:28:36 +0000 2016,True,False,Car enthusiast. Outspoken.,248,12,102,False,en-GB,2,,David Porter Hallett,F5F8FA,,False,,http://pbs.twimg.com/profile_images/747017297034878976/9MG4qBGN_normal.jpg,1DA1F2,DDEEF6,333333,False,davidph89,Tue Jan 02 09:25:23 +0000 2018,[],en,96,"@thetimes Driverless cars take the pleasure out of driving! If I don’t want to drive, I call a taxi!!",,,747013685286158336,"[User(ID=6107422, ScreenName=thetimes)]",False,1017280993
False,Wed Jun 09 16:55:11 +0000 2010,False,False,hi my name is louise tweedley and im a firm believer in what most people don't like to hear the T.R.U.T.H if any1 wants to ask anythink ask away xxx,269,488,4672,False,en,2,,Sharon Tweedley,1A1B1F,http://pbs.twimg.com/profile_background_images/178408172/sharonmlaandlukexxx.jpg,True,https://pbs.twimg.com/profile_banners/153829167/1455128797,http://pbs.twimg.com/profile_images/869992868496236544/W1gc1054_normal.jpg,2FC2EF,252429,666666,True,louiseannxx,NaN,NaN,NaN,258,NaN,Alaska,,153829167,NaN,False,1017280993
False,Sun May 30 16:59:25 +0000 2010,True,False,"Move Closer, Leave Earlier",313,45,269,False,en,4,,MrNiceShoes,C0DEED,http://abs.twimg.com/images/themes/theme1/bg.png,False,,http://pbs.twimg.com/profile_images/880852216696983553/Vsyyxeah_normal.jpg,1DA1F2,DDEEF6,333333,False,MrNiceShoes,Tue Feb 06 08:23:06 +0000 2018,[],ht,693,@GMB @Anna_Soubry Bye bye then sourpuss,,,149947109,"[User(ID=19424427, ScreenName=GMB), User(ID=326184301, ScreenName=Anna_Soubry)]",False,1017280993
False,Tue Mar 22 14:05:22 +0000 2016,True,False,,2223,31,98,False,en,2,"South East, England",david b,F5F8FA,,False,https://pbs.twimg.com/profile_banners/712279003063848961/1472882500,http://pbs.twimg.com/profile_images/771950831402901510/EhydHb6s_normal.jpg,1DA1F2,DDEEF6,333333,False,wokinglad,Thu Feb 08 22:35:56 +0000 2018,[],en,637,"@DarthRational You must be a fake account, surely? Economist ahahaha",,,712279003063848961,"[User(ID=897451614281150465, ScreenName=DarthRational)]",False,1017280993
False,Sun Jun 30 18:51:41 +0000 2013,False,False,Executive Ninja. A Welshman living in England. Discuss....,27899,62,1832,False,en,0,,gareth,C6E2EE,http://abs.twimg.com/images/themes/theme2/bg.gif,False,https://pbs.twimg.com/profile_banners/1558691510/1485935535,http://pbs.twimg.com/profile_images/831260100148994048/mL4jI9xo_normal.jpg,1F98C7,DAECF4,663B12,True,realgpt,NaN,NaN,NaN,2370,NaN,,,1558691510,NaN,False,1017280993
