contributors_enabled,created_at,default_profile,default_profile_image,description,favourites_count,followers_count,friends_count,geo_enabled,lang,listed_count,location,name,profile_background_color,profile_background_image_url,profile_background_tile,profile_banner_url,profile_image_url,profile_link_color,profile_sidebar_fill_color,profile_text_color,protected,screen_name,status_created_at,status_hashtags,status_lang,statuses_count,text,time_zone,url,user_id,user_mentions,verified,follows_subject
False,Sun May 08 06:58:11 +0000 2011,False,False,,823,1203,334,True,en-gb,1,Kingdom of Saudi Arabia,سُعاد.,C0DEED,http://pbs.twimg.com/profile_background_images/378800000008061279/6b61b02fd019456d3abbc3216b58cdad.jpeg,False,https://pbs.twimg.com/profile_banners/295025501/1489971763,http://pbs.twimg.com/profile_images/875629467309228032/SXgpvnUe_normal.jpg,ABB8C2,E5507E,362720,False,itssuesaleh,Tue Dec 26 13:57:58 +0000 2017,[],en,5820,hello everybody !!!!,Baghdad,,295025501,[],False,1017280993
False,Fri Aug 01 00:29:36 +0000 2014,True,False,"For Queen & Country. I love charity work, cats, Horse riding & donating blood",2101,1784,4373,False,en-gb,17,"Hampshire, England",Kev,C0DEED,http://abs.twimg.com/images/themes/theme1/bg.png,False,,http://pbs.twimg.com/profile_images/797827405897408514/xt7q1T25_normal.jpg,1DA1F2,DDEEF6,333333,False,vpharm,Thu Feb 08 21:12:18 +0000 2018,[],en,56,Taxes must rise as services are on a 'knife-edge' says council leader  says the council that wasted £3 MILLION on t… https://t.co/Lwnw8iSpnE,,,2696951179,[],False,1017280993
False,Sat Apr 02 22:40:26 +0000 2016,True,False,Recognition for Commonwealth Contributions Saving Uk from Europe. WWI. WW2 etc Big Believer in Right and Wrong. # Make My Day. #brexit Remoaner allergy #MAGA,10069,691,1421,True,en-gb,0,uk.   nz,Marrk .L,F5F8FA,,False,https://pbs.twimg.com/profile_banners/716394891560009728/1493062467,http://pbs.twimg.com/profile_images/856592384855068672/sfCx46NE_normal.jpg,1DA1F2,DDEEF6,333333,False,lonie_mark,Thu Feb 08 20:07:54 +0000 2018,[],en,13758,"RT @CollinRugg: Russia investigation has been going on for well over a year:

Evidence of wrongdoing by Trump:

1.
2.
3.

Evidence of Dem/F…",,,716394891560009728,"[User(ID=785649571787444225, ScreenName=CollinRugg)]",False,1017280993
False,Sun Aug 28 20:59:52 +0000 2016,True,False,"Just an ordinary teenager... However I don't do drugs
@MoyesNMore series 2 coming soon",539,836,543,True,en,9,"England, United Kingdom",Jake Moyes,F5F8FA,,False,https://pbs.twimg.com/profile_banners/770002986126966784/1499885034,http://pbs.twimg.com/profile_images/881504051380269058/E5mbJc5T_normal.jpg,1DA1F2,DDEEF6,333333,False,TheJakeMoyes,Wed Feb 07 21:08:20 +0000 2018,[],en,1373,"RT @DerrenLitten: Thrilled to announce the documentary to celebrate our birthday ""Benidorm - Ten Years On Holiday"" will be aired Tuesday 20…",,https://t.co/wXua7KmmTr,770002986126966784,"[User(ID=724983102, ScreenName=DerrenLitten)]",False,1017280993
False,Wed Aug 31 10:09:59 +0000 2016,False,False,This account is still live but is only checked periodically due work commitments,230,301,1198,False,en-gb,8,,folio watch,000000,http://abs.twimg.com/images/themes/theme1/bg.png,False,https://pbs.twimg.com/profile_banners/770926601999622145/1477063517,http://pbs.twimg.com/profile_images/770930848241688576/nE7pacct_normal.jpg,FAB81E,000000,000000,False,foliowatchSE1,Fri Apr 21 17:25:24 +0000 2017,[],en,371,Good luck with tonights meeting &amp; thanks in advance to @cllr_anood @coyleneil @SwkMediation &amp; @NottingHillHG for taking the time to attend,,https://t.co/3urCJTWaVB,770926601999622145,"[User(ID=632951099, ScreenName=cllr_anood), User(ID=248186795, ScreenName=coyleneil), User(ID=4825736579, ScreenName=SwkMediation), User(ID=700841419, ScreenName=NottingHillHG)]",False,1017280993
False,Tue Jan 26 06:32:41 +0000 2016,True,False,"A European think tank committed to direct democracy in Europe.Non partisan, intends to restore politics into the hands of the people.French tweets @IDDEinFrench",4,391,43,False,en,12,"Brussels, Belgium",IDDE - EN,F5F8FA,,False,https://pbs.twimg.com/profile_banners/4848503037/1453802900,http://pbs.twimg.com/profile_images/691923491382235136/yy6aGBem_normal.jpg,1DA1F2,DDEEF6,333333,False,IDDEinEnglish,Fri Nov 04 19:26:27 +0000 2016,[],en,109,Watch the IDDE's European Freedom Award here live: https://t.co/fD3OlOQJ2I,,https://t.co/fshZvUCuAc,4848503037,[],True,1017280993
False,Thu May 27 18:04:25 +0000 2010,True,False,A Patriotic Brit who values our culture and history. totally supportive of a clean #Brexit  #forBritain,763,856,995,True,en,16,,HardBrexit_dog,C0DEED,http://abs.twimg.com/images/themes/theme1/bg.png,False,https://pbs.twimg.com/profile_banners/148824581/1506031868,http://pbs.twimg.com/profile_images/925444061766418433/40_490FX_normal.jpg,1DA1F2,DDEEF6,333333,False,HardBrexit_dog,Mon Feb 05 18:10:52 +0000 2018,[],en,7571,"RT @CllrBSilvester: Remain Loons Send Death Threat to 80 Year-Old Brexiter 
Remember that when Remoaners claim they are the voice of “kindn…",,,148824581,"[User(ID=314548237, ScreenName=CllrBSilvester)]",False,1017280993
False,Tue Jan 20 00:10:53 +0000 2009,False,False,Simple conservative,621,1219,2654,True,en,59,Wales/ Cymru,Gillibrand,9AE4E8,http://pbs.twimg.com/profile_background_images/650451445/h9y6c83epbih7ydpbxie.jpeg,True,https://pbs.twimg.com/profile_banners/19210198/1473187030,http://pbs.twimg.com/profile_images/1153713440/57986_10150279677080301_901000300_14649110_5334112_n_normal.jpg,0084B4,DDFFCC,333333,False,Gillibrand,Thu Feb 08 16:28:32 +0000 2018,"[Hashtag(Text='feastday'), Hashtag(Text='china')]",en,14081,The latest The Gillibrand Daily! https://t.co/Fcv1iZyyPJ Thanks to @DavidHadley1973 @CFoI @JoaoMMXIV #feastday #china,Amsterdam,,19210198,"[User(ID=3344564308, ScreenName=DavidHadley1973), User(ID=85595740, ScreenName=CFoI), User(ID=2835068783, ScreenName=JoaoMMXIV)]",False,1017280993
False,Thu Sep 11 23:20:53 +0000 2014,True,False,"English and proud, pro British,  supporting full Brexit 100% for a fully Sovereign UK. Anyone who adds me to a list will be blocked.",2286,1089,105,False,en-gb,65,,Patricia Bernier,C0DEED,http://abs.twimg.com/images/themes/theme1/bg.png,False,,http://pbs.twimg.com/profile_images/752515458033602562/M8zfHQ8y_normal.jpg,1DA1F2,DDEEF6,333333,False,Pannie321,Thu May 18 21:29:58 +0000 2017,"[Hashtag(Text='BBC'), Hashtag(Text='ThreeGirls')]",en,104242,"RT @A_Liberty_Rebel: #BBC did well making &amp; airing #ThreeGirls.
But let’s not forget it wasn’t, &amp; still isn’t, a mere three, but literally…",London,,2804480622,"[User(ID=243393079, ScreenName=A_Liberty_Rebel)]",False,1017280993
False,Sun Oct 25 21:25:56 +0000 2015,True,False,Re-tweets are not endorsements. Victims want the Govt to support the 1m Bradford & Bingley working class victims who lost ££'s when their bank was nationalised,17619,1380,1192,False,en,3,,Grumpy Fred,C0DEED,http://abs.twimg.com/images/themes/theme1/bg.png,False,,http://pbs.twimg.com/profile_images/698846312607916032/7eM-TvoW_normal.jpg,1DA1F2,DDEEF6,333333,False,grumpyfred3,Thu Feb 08 23:34:34 +0000 2018,[],en,30149,"RT @fishingforleave: Not only does the ""transition"" mean obeying ALL EU law we'll have no defense against EU implementing punishing laws to…",Pacific Time (US & Canada),,4041645983,"[User(ID=722953111107567618, ScreenName=fishingforleave)]",False,1017280993
False,Sat Apr 30 13:25:51 +0000 2016,True,False,I am diesel mechanic I have beautiful wife and daughter,6732,486,2992,True,en,1,"Beaverton, OR",Derek Culver,F5F8FA,,False,https://pbs.twimg.com/profile_banners/726402186289143808/1467038595,http://pbs.twimg.com/profile_images/747440166206218240/j50XTzVL_normal.jpg,1DA1F2,DDEEF6,333333,False,derekculver32,Wed Feb 07 02:26:21 +0000 2018,[],en,813,@ChrisJack_Getty Congratulations to you. You been a blessings to England.,,,726402186289143808,"[User(ID=114779087, ScreenName=ChrisJack_Getty)]",False,1017280993
False,Mon Aug 29 01:37:57 +0000 2016,True,True,,0,0,45,False,en,0,,Working,F5F8FA,,False,,http://abs.twimg.com/sticky/default_profile_images/default_profile_normal.png,1DA1F2,DDEEF6,333333,True,whytwrkinclass,NaN,NaN,NaN,0,NaN,,,770072966810009600,NaN,False,1017280993
False,Thu Sep 13 21:37:07 +0000 2012,True,False,"Father Son & Holy Ghost frist. Prayers for Israel' s safety. Love of Country, Military, Veterans and all Americans. Love my @POTUS @realDonaldTrump",256091,4619,5010,False,en,147,"Washington, DC",brenda sylvester,C0DEED,http://abs.twimg.com/images/themes/theme1/bg.png,False,https://pbs.twimg.com/profile_banners/822225433/1497886817,http://pbs.twimg.com/profile_images/874502984683728897/-w9hA5I5_normal.jpg,1DA1F2,DDEEF6,333333,False,sylvesterbrenda,Thu Feb 08 22:09:30 +0000 2018,[],nl,214156,RT @michellemalkin: $$$$$$$$$$$$$$$$$wamp https://t.co/QHxS429FrV,,,822225433,"[User(ID=15976697, ScreenName=michellemalkin)]",False,1017280993
False,Tue May 26 09:34:16 +0000 2009,True,False,"Neologic sapiosexual, epicurean hedonist, unapologetic idealist, citizen and ardent space science enthusiast,  UFOs, augmented reality and Geospatial consultant",130,873,5001,True,en,1,,LKM,C0DEED,http://abs.twimg.com/images/themes/theme1/bg.png,False,https://pbs.twimg.com/profile_banners/42594928/1363283669,http://pbs.twimg.com/profile_images/378800000340714912/2e8c614b1f75d09af5cbdd25b872aef9_normal.jpeg,1DA1F2,DDEEF6,333333,False,LobizKip,Sat Dec 23 06:56:52 +0000 2017,[],und,686,@OleItumbi https://t.co/22PTQbL69k,,,42594928,"[User(ID=68382599, ScreenName=OleItumbi)]",False,1017280993
False,Tue Aug 02 21:42:30 +0000 2016,True,False,,5025,267,825,True,en,15,,The Red Side,F5F8FA,,False,https://pbs.twimg.com/profile_banners/760591629551964160/1479819518,http://pbs.twimg.com/profile_images/863441650672185344/AY5ccei4_normal.jpg,1DA1F2,DDEEF6,333333,False,OfficialRedSide,Thu Feb 08 23:44:25 +0000 2018,[],en,10201,"RT @PrisonPlanet: I've never seen far-left ideologies &amp; propaganda getting so decimated in comments sections.

We're winning the argument,…",Pacific Time (US & Canada),,760591629551964160,"[User(ID=18643437, ScreenName=PrisonPlanet)]",False,1017280993
False,Sat Aug 02 00:39:11 +0000 2014,False,False,"The English do not care what colour, race, religion or sexuality you are, we only ask that our green and fair land be respected and we live together in peace.",4224,3806,2741,True,en,79,"England, United Kingdom",Take Back Control,000000,http://abs.twimg.com/images/themes/theme1/bg.png,False,https://pbs.twimg.com/profile_banners/2699496506/1497182374,http://pbs.twimg.com/profile_images/958485632006967296/wYh9Dabb_normal.jpg,4800B3,000000,000000,False,GrahamHmoore,Wed Feb 07 20:05:19 +0000 2018,[],en,34623,what he means is the FBI has caused long term damage to the FBI https://t.co/WBWwhUsRij,London,https://t.co/B5eO4wOCLv,2699496506,[],False,1017280993
False,Thu Aug 15 18:43:11 +0000 2013,False,False,Official UKIP Bath & North East Somerset Branch page for #Bath. We campaign in #Bath for an independent nation. New members welcome. Email: info@bathukip.org.uk,1800,1717,1356,False,en,59,"Bath, England",Bath UKIP,C0DEED,http://abs.twimg.com/images/themes/theme1/bg.png,False,https://pbs.twimg.com/profile_banners/1673844451/1471781578,http://pbs.twimg.com/profile_images/959908857207312384/58TSZEhR_normal.jpg,9C23C4,DDEEF6,333333,False,BathUKIP,Thu Feb 08 00:14:52 +0000 2018,[Hashtag(Text='EU')],en,1376,The #EU is now openly hostile towards us. Relationship broken down irretrievably and no longer reflects the faintes… https://t.co/IUNSJGUCVr,London,http://t.co/ZtkNjQyQKf,1673844451,[],False,1017280993
False,Thu Apr 22 10:03:09 +0000 2010,True,True,,8,10,94,False,en,0,,Sheila Bell,C0DEED,http://abs.twimg.com/images/themes/theme1/bg.png,False,,http://abs.twimg.com/sticky/default_profile_images/default_profile_normal.png,1DA1F2,DDEEF6,333333,False,trigometric,Wed Jan 03 17:23:40 +0000 2018,[],en,124,"When the NHS was formed in 1948, the population of UK was about 50 million people. NHS now has to cater for... https://t.co/GM6oYMT70G",,,135829490,[],False,1017280993
False,Fri Nov 07 17:49:10 +0000 2008,True,False,"Pragmatic Libertarian, Science and Technology junkie, Rational Optimist with cynical underpinnings, and IT Security professional. This is my personal account.",1280,203,724,False,en,18,Mitcham,Bob Grahame,C0DEED,http://abs.twimg.com/images/themes/theme1/bg.png,False,,http://pbs.twimg.com/profile_images/803000726393880576/eB-T9EQI_normal.jpg,1DA1F2,DDEEF6,333333,False,bob_grahame,Wed Feb 07 19:58:50 +0000 2018,[Hashtag(Text='GE2017')],en,3234,RT @croydon_ukip: For #GE2017 UKIP delivered a rounded and fully funded manifesto.  Spend a few minutes looking at our policies on Mental H…,London,,17235131,"[User(ID=771373403655864320, ScreenName=croydon_ukip)]",False,1017280993
False,Fri Sep 16 20:07:22 +0000 2011,False,False,Host of The Tommy Robinson Show on @TheRebelTV. Subscribe now at https://t.co/Q98W9S6lzf,59241,394119,12539,True,en-gb,2037,Luton England ,Tommy Robinson 🇬🇧,C0DEED,http://pbs.twimg.com/profile_background_images/378800000091148976/e3260dabed10866078218b034f58e9b8.png,True,https://pbs.twimg.com/profile_banners/374712154/1514306027,http://pbs.twimg.com/profile_images/934710599619137536/A1AJ0BI4_normal.jpg,0084B4,DDEEF6,333333,False,TRobinsonNewEra,Thu Feb 08 23:35:18 +0000 2018,[],en,100176,"RT @brianoflondon: This is the original video of @TRobinsonNewEra and his kids being thrown out of a pub in Cambridge.

He’s going to court…",London,https://t.co/VdOM35LuQ4,374712154,"[User(ID=18085903, ScreenName=brianoflondon), User(ID=374712154, ScreenName=TRobinsonNewEra)]",False,1017280993
False,Mon Aug 22 06:31:04 +0000 2016,True,False,,25,329,4838,False,zh-cn,3,,steven,F5F8FA,,False,,http://pbs.twimg.com/profile_images/767611567789576192/SIa5DdUh_normal.jpg,1DA1F2,DDEEF6,333333,False,steven77108556,Tue Apr 04 13:55:40 +0000 2017,[],en,1993,Baby injections crying Baby vaccination V2 4: https://t.co/CM5g6IxFZq via @YouTube,,,767610019059683328,"[User(ID=10228272, ScreenName=YouTube)]",False,1017280993
False,Fri Aug 26 22:16:08 +0000 2016,True,False,,23,5,82,True,en,0,"Manchester, England",Alex Smith,F5F8FA,,False,https://pbs.twimg.com/profile_banners/769297404130648065/1472250177,http://pbs.twimg.com/profile_images/769299111791169536/QqMuZuIq_normal.jpg,1DA1F2,DDEEF6,333333,False,asmith5555511,Sun Sep 04 07:56:22 +0000 2016,[],en,35,@ONC3X @_k4k_ @Furiouskurd was that to piss me off? I drink too! You are so scared of Muslims that you're supporting another terrorist group,,,769297404130648065,"[User(ID=2672595537, ScreenName=ONC3X), User(ID=101879285, ScreenName=_k4k_), User(ID=874918545578131457, ScreenName=furiouskurd)]",False,1017280993
False,Sat Jan 24 14:28:28 +0000 2015,False,False,Somerset // Bournemouth University // Politics,5240,736,3771,False,en,0,"England, United Kingdom",Luke Mitchell,000000,http://abs.twimg.com/images/themes/theme1/bg.png,False,https://pbs.twimg.com/profile_banners/2995954150/1506081476,http://pbs.twimg.com/profile_images/933105113257861121/kldw3kka_normal.jpg,1B95E0,000000,000000,True,lukxmitchxll,NaN,NaN,NaN,2914,NaN,Pacific Time (US & Canada),,2995954150,NaN,False,1017280993
False,Thu Jun 14 18:35:45 +0000 2012,True,False,Twin loves: free church and free markets. Fundamentalist. Unionist. Monarchist. Brumophile. These are purely my personal views.,2611,127,309,False,en,4,England,Chris Pateman,C0DEED,http://abs.twimg.com/images/themes/theme1/bg.png,False,,http://pbs.twimg.com/profile_images/766919703600197632/27hmpqh7_normal.jpg,1DA1F2,DDEEF6,333333,False,ChrisPateman2,Mon Feb 05 16:05:42 +0000 2018,[],en,2871,"RT @HTAnews: Want to come and work for the HTA? We have a range of roles available here at the HTA HQ, so if you want to come and join us,…",Amsterdam,,608375942,"[User(ID=279065142, ScreenName=HTAnews)]",False,1017280993
False,Thu Aug 13 19:48:24 +0000 2015,True,True,,1,8,29,False,en,0,,Joanna Kinyanjui,C0DEED,http://abs.twimg.com/images/themes/theme1/bg.png,False,,http://abs.twimg.com/sticky/default_profile_images/default_profile_normal.png,1DA1F2,DDEEF6,333333,False,KinyanjuiJoanna,NaN,NaN,NaN,0,NaN,,,3420751251,NaN,False,1017280993
False,Sat May 16 09:57:08 +0000 2015,True,False,"Old, uneducated, frustrated redneck, homophobic xenophobe, racist, right-winger, neo-fascist, populistic zealot, simply typical Trump supporter.",1008,134,409,False,en,2,j.mp/OpavaCR,Stanislav Hledík,C0DEED,http://abs.twimg.com/images/themes/theme1/bg.png,False,https://pbs.twimg.com/profile_banners/3260056047/1435090662,http://pbs.twimg.com/profile_images/613620772884471808/X5JoGBf2_normal.png,1DA1F2,DDEEF6,333333,False,hlediks,Thu Feb 08 05:11:54 +0000 2018,[],cs,2636,"Německo má vládu a opět a ""opět se může ujmout vedoucí role v Evrope"". Myslí tím vedoucí roli před 75 lety?",Prague,http://t.co/MR7IsLTjJV,3260056047,[],False,1017280993
False,Sat Nov 08 07:32:04 +0000 2014,True,False,316,3006,591,2398,False,en,1,"Gauteng, South Africa",Pierre Prinsloo,C0DEED,http://abs.twimg.com/images/themes/theme1/bg.png,False,https://pbs.twimg.com/profile_banners/2866967409/1492856442,http://pbs.twimg.com/profile_images/860777130996752386/PeYP2OX3_normal.jpg,1DA1F2,DDEEF6,333333,False,PrinslooPierre,Fri Dec 29 12:04:52 +0000 2017,[],en,1752,"RT @SenatorCollins: Senate unanimously passed a resolution I introduced w/ @SenAngusKing designating Dec. 16, 2017, as Wreaths Across Ameri…",,,2866967409,"[User(ID=19726613, ScreenName=SenatorCollins), User(ID=1068481578, ScreenName=SenAngusKing)]",False,1017280993
False,Mon Dec 24 19:10:26 +0000 2012,True,False,"knowing others is wisdom, knowing yourself is enlightenment~lao tzu",1006,142,1602,False,en,0,,Adam Ley,C0DEED,http://abs.twimg.com/images/themes/theme1/bg.png,False,https://pbs.twimg.com/profile_banners/1033284872/1435317067,http://pbs.twimg.com/profile_images/882721294898405376/UHWikh0-_normal.jpg,1DA1F2,DDEEF6,333333,False,LeyAdamley56789,Thu Jan 04 22:33:43 +0000 2018,[Hashtag(Text='itvnews')],en,56,@itvnews WTF is this fat acceptance shit on ITV news!? #itvnews,London,,1033284872,"[User(ID=21866939, ScreenName=itvnews)]",False,1017280993
False,Mon Sep 05 07:51:34 +0000 2011,True,False,#UKIP Supporter All Tweets are in a personal capacity - RT's are not endorsements. #DianeForLeader #Diane4UKIP #TeamDiane,625,81,200,False,en,0,Kent & London,Alice_UKIP,C0DEED,http://abs.twimg.com/images/themes/theme1/bg.png,False,https://pbs.twimg.com/profile_banners/368204187/1472023415,http://pbs.twimg.com/profile_images/768349969795297280/98JYbxs__normal.jpg,1DA1F2,DDEEF6,333333,False,little_smee,Thu Aug 25 20:27:29 +0000 2016,[Hashtag(Text='Gravesend')],en,654,"RT @DianeJamesMEP: Here are the highlights from my speech to @UKIP members in #Gravesend last night
https://t.co/6phww8GnFN",,https://t.co/d0ihtdEtwy,368204187,"[User(ID=2673995912, ScreenName=DianeJamesMEP), User(ID=358204197, ScreenName=UKIP)]",False,1017280993
False,Sun Oct 02 22:17:12 +0000 2011,False,False,Retired environmental chemist.  Manmade global warming sceptic.,141,320,260,True,en,32,"Lisburn, UK, 54d31'N 6d02'W",Alan Love,000000,http://abs.twimg.com/images/themes/theme10/bg.gif,False,,http://pbs.twimg.com/profile_images/842720589433503744/zGZVfQb3_normal.jpg,9266CC,000000,000000,False,AlanLove1,Thu Feb 08 17:33:10 +0000 2018,[],en,5320,Here in the UK we need not be too smug.  We are not too far behind the Swedes in adopting barbarism in the name... https://t.co/BZo6BItLPK,London,https://t.co/cIvpiyRxmN,384006329,[],False,1017280993
False,Thu Dec 08 23:32:56 +0000 2011,True,False,aceeventphotos007@gmail.com add my facebook page https://t.co/NhYUWTAlLj instagram ace_event_photos,27934,1098095,1227233,True,en,813,London,Ace Event Photos,C0DEED,http://abs.twimg.com/images/themes/theme1/bg.png,False,https://pbs.twimg.com/profile_banners/432029072/1512346284,http://pbs.twimg.com/profile_images/782996725598449664/sSIkW1YR_normal.jpg,1DA1F2,DDEEF6,333333,False,photo_ace,Tue Feb 06 22:55:23 +0000 2018,[],und,128185,RT @photo_ace: https://t.co/NynzfuGSnc,London,,432029072,"[User(ID=432029072, ScreenName=photo_ace)]",False,1017280993
False,Thu Jul 28 19:16:46 +0000 2016,True,True,,0,24,890,False,en-gb,0,,MAGNUS SIGMAR,F5F8FA,,False,,http://abs.twimg.com/sticky/default_profile_images/default_profile_normal.png,1DA1F2,DDEEF6,333333,False,NealSigmar,Sat Sep 16 17:49:03 +0000 2017,[],en,55,@AnnaJonesSky I've really enjoyed watching coverage of the Parsons Green terror attack! Looking forward to any future coverage! Stay safe😎,,,758743014114066436,"[User(ID=72519794, ScreenName=AnnaJonesSky)]",False,1017280993
False,Sun Jun 15 13:49:52 +0000 2014,False,False,CEO of SMCS RISK. Director of GEI Mekong. Strong advocate for protecting children & the environment. Based in Cambodia.,1709,370,772,True,en,43,Asia,Steve Morrish,000000,http://abs.twimg.com/images/themes/theme1/bg.png,False,https://pbs.twimg.com/profile_banners/2569078693/1496541074,http://pbs.twimg.com/profile_images/957209121098416133/04BKFWwd_normal.jpg,19CF86,000000,000000,False,worldoracle,Thu Feb 08 23:27:25 +0000 2018,[],en,2335,@mitchellvii Well if thats true Bill then Mueller is a terrible investigator because there is so much evidence alre… https://t.co/mChT0Jg2ej,Hanoi,https://t.co/DY3bCTgFY5,2569078693,"[User(ID=17980523, ScreenName=mitchellvii)]",False,1017280993
False,Wed Nov 28 18:52:31 +0000 2012,True,False,"Northern Xposure are a Lively, Edgy covers band, They cover all genres of music.Northern Xposure Guarantee to keep the dancefloor FULL all night, with ALL ages!",246,640,1458,True,en,4,Lichfield,Northern Xposure,C0DEED,http://abs.twimg.com/images/themes/theme1/bg.png,False,https://pbs.twimg.com/profile_banners/976748071/1443918068,http://pbs.twimg.com/profile_images/656397051522064384/GA-vjRQA_normal.jpg,1DA1F2,DDEEF6,333333,False,NorthernXpo,Sun Dec 31 23:00:25 +0000 2017,[],en,2113,Getting Warmer.... https://t.co/SQOU83Zaoi,Casablanca,https://t.co/1sK2eMsk0p,976748071,[],False,1017280993
False,Wed Nov 30 17:27:52 +0000 2011,True,False,ClassicalLib-AGWSceptic ♥=Brexit-Trump-Mogg4PM-FossilFuel-1776-Israel-1&2A-Breitbart-Infowars-Jesus-AynRand-T.Paine/H8=Jihad-Globalism-OverPopMyth-Weed,8876,1929,4956,False,en,25,"England, United Kingdom",Clean Brexit is Brexit!,C0DEED,http://abs.twimg.com/images/themes/theme1/bg.png,False,https://pbs.twimg.com/profile_banners/425181608/1517948559,http://pbs.twimg.com/profile_images/960972402690871296/5gsQkJ9k_normal.jpg,1DA1F2,DDEEF6,333333,False,Britainisim,Thu Feb 08 14:56:00 +0000 2018,[],en,30103,"LIVE: Mogg for Leader, May's Brexit balls-up and Anna Soubry's monumenta... https://t.co/BmhIT5E2Mu via @YouTube",Pacific Time (US & Canada),https://t.co/yxoyLJXmMH,425181608,"[User(ID=10228272, ScreenName=YouTube)]",False,1017280993
False,Sat Jul 04 21:35:16 +0000 2015,True,False,,2418,2706,4464,False,en,13,UNITED KINGDOM,QUIZMASTER,C0DEED,http://abs.twimg.com/images/themes/theme1/bg.png,False,https://pbs.twimg.com/profile_banners/3359431816/1476661477,http://pbs.twimg.com/profile_images/789123592642519041/jX5fqm3h_normal.jpg,1DA1F2,DDEEF6,333333,False,VxQuizmaster,Wed Oct 19 10:19:21 +0000 2016,[],en,6257,WITNESS PROTECTION PROGRAM.https://t.co/1aJzLNvGtT https://t.co/IGZQT4wiPe,,,3359431816,[],False,1017280993
False,Mon Aug 19 16:50:38 +0000 2013,True,False,.1.,2263,292,1670,True,en,2,,Klopp1,C0DEED,http://abs.twimg.com/images/themes/theme1/bg.png,False,https://pbs.twimg.com/profile_banners/1683671778/1441026110,http://pbs.twimg.com/profile_images/652587828614950912/F9o5xG3C_normal.jpg,1DA1F2,DDEEF6,333333,False,LFC__Live,Mon Jan 01 23:40:05 +0000 2018,[],en,332,RT @IsraeliPM: I wish the Iranian people success in their noble quest for freedom. https://t.co/7MRC3UWzTz,,,1683671778,"[User(ID=141084952, ScreenName=IsraeliPM)]",False,1017280993
False,Sat Aug 06 14:04:48 +0000 2016,True,False,AUDENTES FORTUNA IUVAT,0,9,20,False,en,0,UKIP NEC,UKIP Strike Team,F5F8FA,,False,https://pbs.twimg.com/profile_banners/761925997008650240/1471724087,http://pbs.twimg.com/profile_images/767092424514609152/t0qcnneS_normal.jpg,1DA1F2,DDEEF6,333333,False,UKIPStrikeTeam,NaN,NaN,NaN,0,NaN,Pacific Time (US & Canada),,761925997008650240,NaN,False,1017280993
False,Thu Dec 23 10:20:28 +0000 2010,False,False,Secretary #UKIP Bath & NE Somerset Branch and UKIP candidate for 2015 Local Elections. Tweets and re-tweets do not necessarily reflect UKIP policy. 🇬🇧,2002,672,1160,False,en,63,"South West, England",Steve Grimes 🇬🇧 💂🏻,C0DEED,http://abs.twimg.com/images/themes/theme1/bg.png,False,https://pbs.twimg.com/profile_banners/229794164/1471812924,http://pbs.twimg.com/profile_images/794561000531955714/m2qSp49S_normal.jpg,96128D,DDEEF6,333333,False,grimes_steve,Wed Jan 10 08:00:57 +0000 2018,[],en,143,RT @lordstoddart: I am rarely lost for words but Virgin's decision to axe the Daily Mail from its trains has left me speechless! How can an…,London,,229794164,"[User(ID=2160745572, ScreenName=lordstoddart)]",False,1017280993
False,Tue Nov 03 00:28:11 +0000 2015,True,False,,34018,1841,4996,False,en,39,,Highballer,C0DEED,http://abs.twimg.com/images/themes/theme1/bg.png,False,https://pbs.twimg.com/profile_banners/4100919203/1471486490,http://pbs.twimg.com/profile_images/825861932171280384/vvOXdfZk_normal.jpg,1DA1F2,DDEEF6,333333,False,highgrader9536,Thu Feb 08 22:47:12 +0000 2018,[],en,38722,RT @PrisonPlanet: Please don't. https://t.co/0PSG8toYZ8,,,4100919203,"[User(ID=18643437, ScreenName=PrisonPlanet)]",False,1017280993
